ИНН;Краткое наименование;Город;Регион;Должность руководителя;Фамилия руководителя;Имя руководителя;Отчество руководителя;Сумма генподряда;Статус в СРО;Статус торгов;Членские взносы;Страхвка;Проверка;Допуск выдан;Юридический адрес;Фактический адрес;Телефон;Факс;E-mail;Веб-сайт;Полное наименование;ОГРН;КПП;Номер свидетельства;Виды работ
"""6708005960""";ООО «АМАЛЬГАМА К» ;п. Кардымово;;Генеральный директор;Шукалов;Владимир;Иванович;;Действует;;;05.08.2014;;24.07.2013;215850, Смоленская область, Кардымовский район, р.п. Кардымово, ул. Социалистическая, д. 28;215850, Смоленская область, Кардымовский район, р.п. Кардымово, ул. Социалистическая, д. 28;(8481) 67-412-07;67-412-07;amalgama-mtsf@mail.ru;;Общество с ограниченной ответственностью «АМАЛЬГАМА К»;"""1096727000182""";;"""0246.05-2013-6708005960-С-110""";
"""6730046376""";ООО «Комплекс Плюс» ;Смоленск;;Генеральный директор;Куксов;Юрий;Владимирович;;Действует;;;16.03.2015;;10.06.2014;214013, г. Смоленск, ул. Пригородная, д. 11, кв. 168;214013, г. Смоленск, ул. Пригородная, д. 11, кв. 168;(4812) 273716;219138;kompleks4@mail.ru;;Общество с ограниченной ответственностью «Комплекс Плюс»;"""1026701440919""";;"""0247.09-2014-6730046376-С-110""";
"""6731061761""";ООО «Энергия» ;г. Смоленск;;;;;;;Действует;;;08.03.2015;;01.12.2010;214019, г. Смоленск, ул. Тенишевой, д. 27, оф. 23;214019, г. Смоленск, ул. Тенишевой, д. 27, оф. 23;(4812) 693981;360574;terexov-an@smolen.ru;;Общество с ограниченной ответственностью «Энергия»;"""1076731007913""";;"""0248.02-2010-6731061761-С-110""";
"""6725007276""";ООО Фирма «Малая механизация» ;Десногорск;;Директор;Мареев;Александр;Павлович;;Действует;;;03.05.2015;;13.04.2012;216400, Смоленская обл., г. Десногорск, 1-й микрорайон, д. 12, кв. 49;216400, Смоленская обл., г. Десногорск, 1-й микрорайон, д. 12, кв. 49;(48153) 3-00-53;3-00-53;malmeh@mail.ru;;Общество с ограниченной ответственностью Фирма «Малая механизация»;"""1026700927043""";;"""0249.05-2012-6725007276-С-110""";
"""6729013827""";ООО «Созидание» ;г.Смоленск;;Директор;Чабанов;Сабир;Ниязович;;Действует;;;11.04.2015;;30.09.2014;2140011, г.Смоленск, ул. Губенко, д. 46;2140011, г.Смоленск, ул. Губенко, д. 46;(4812) 418486;418486;;;Общество с ограниченной ответственностью «Созидание»;"""1026701424045""";;"""0250.05-2014-6729013827-С-110""";
"""6730074479""";ООО «Современные Строительные Технологии» ;г. Смоленск;;Генеральный директор;Ромашова;Любовь;Ивановна;;Действует;;;09.02.2015;;14.01.2013;214031, г. Смоленск, ул. Индустриальная, д.7;214031, г. Смоленск, ул. Индустриальная, д.7;(4812) 622884;610230;sstsmolensk@mail.ru;;Общество с ограниченной ответственностью «Современные Строительные Технологии»;"""1086731001213""";;"""0252.03-2013-6730074479-С-110""";
"""6723018956""";ООО «МАЯК» ;Гагарин;;Директор;Загородний;Вадим;Владимирович;;Действует;;;19.04.2015;;30.04.2013;215010, Смоленская область, г. Гагарин, Первомайский проезд, д.1;215010, Смоленская область, г. Гагарин, Первомайский проезд, д.1;(48134) 41956;41454;vvz5@yandex.ru;;Общество с ограниченной ответственностью «МАЯК»;"""1056730005947""";;"""0256.04-2013-6723018956-С-110""";
"""6722024065""";ООО «Вязьма-Стройсервис» ;Вязьма;;Генеральный директор;Винокуров;Сергей;Юрьевич;;Действует;;;31.12.2014;;10.12.2010;215119, Смоленская область, г. Вязьма, ул. Строителей, д. 3;215119, Смоленская область, г. Вязьма, ул. Строителей, д. 3;(48131) 51549;53708;chernova.pto@mail.ru;;Общество с ограниченной ответственностью «Вязьма-Стройсервис»;"""1096722000870""";;"""0257.02-2010-6722024065-С-110""";
"""6730050654""";ООО «Аркада – Инжиниринг» ;г. Смоленск;;зам.ген.директора по капстроительству;Хаванская;Нина;Алексеевна;;Действует;;;27.12.2014;;08.08.2012;214030, г. Смоленск, ул. Краснинское шоссе, д. 35;214030, г. Смоленск, ул. Краснинское шоссе, д. 35;(4812) 668298;668822;;;Общество с ограниченной ответственностью «Аркада – Инжиниринг»;"""1036758331103""";;"""0258.04-2012-6730050654-С-110""";
"""6714031975""";ООО «СК-ПЕРСПЕКТИВА» ;п.г.т. Красный;;Директор;Трифоненков;Игорь;Викторович;;Действует;;;03.06.2014;;04.06.2013;214038, г.Смоленск, ул.Кловская, д.23А, кв.280;214038, г.Смоленск, ул.Кловская, д.23А, кв.280;(48145) 41189;41189;;;Общество с ограниченной ответственностью «СК-ПЕРСПЕКТИВА»;"""1116714000534""";;"""0260.05-2013-6714031975-С-110""";
"""6723008073""";ООО «Гжатсксервисстрой» ;г. Гагарин;;Генеральный директор;Лукашов;Петр;Михайлович;;Действует;;;05.04.2015;;16.11.2010;215010, Смоленская область, г. Гагарин, Промышленный проезд, д. 1;215010, Смоленская область, г. Гагарин, Промышленный проезд, д. 1;(48135) 42740;42536;;;Общество с ограниченной ответственностью «Гжатсксервисстрой»;"""1026700882834""";;"""0261.02-2010-6723008073-С-110""";
"""6730079131""";ООО «СК Мостотранс» ;г. Смоленск;;Директор;Майоров;Анатолий;Владимирович;;Действует;;;10.09.2015;;;214000, г. Смоленск, ул. Глинки, 7;214000, г. Смоленск, ул. Глинки, 7;;;;;Общество с ограниченной ответственностью «Строительная Компания Мостотранс»;"""1086731013687""";;"""0263.03-2010-6730079131-С-110""";
"""6731065678""";ЗАО «Стройтрест №1» ;г. Смоленск;;Генеральный директор;Зохан;Николай;Дмитриевич;;Действует;;;31.12.2014;;27.12.2011;214031, г. Смоленск, ул. Индустриальная, д.2, оф.203;214031, г. Смоленск, ул. Индустриальная, д.2, оф.203;(4812) 31-00-61;31-00-61;sokhan@mail.ru;;Закрытое акционерное общество «Стройтрест №1»;"""1076731018363""";;"""0264.04-2011-6731065678-С-110""";
"""6722019675""";ООО «Газспецстрой-Вязьма» ;г. Вязьма;;Генеральный директор;Стецкий;Александр;Владимирович;;Действует;;;20.07.2014;;01.12.2010;215113, Смоленская область, г. Вязьма, ул. Панино, 20;215113, Смоленская область, г. Вязьма, ул. Панино, 20;;;Smolenskgazstroy-vz@yandex.ru;;Общество с ограниченной ответственностью «Газспецстрой-Вязьма»;"""1066722008132""";;"""0265.02-2010-6722019675-С-110""";
"""6723021109""";ООО «РусАрмСтрой» ;д.Поличня;;Генеральный директор;Мартиросян;Лерник;Артюни;;Действует;;;;;27.02.2014;215039, Смоленская область, Гагаринский район, д.Поличня;215039, Смоленская область, Гагаринский район, д.Поличня;(48135) 3-61-64;3-61-64;eev-65@mail.ru;;Общество с ограниченной ответственностью «РусАрмСтрой»;"""1076723000860""";;"""0268.08-2014-6723021109-С-110""";
"""7715743896""";ООО «РВК-Медсистемы» ;г. Москва;;Генеральный директор;Романишин;Виталий;Филиппович;;Действует;;;30.06.2015;;13.04.2012;127549, г. Москва, ул. Бибиревская, стр. 4;127549, г. Москва, ул. Бибиревская, стр. 4;(499);5580174;batura_nf@list.ru;;Общество с ограниченной ответственностью «РВК-Медсистемы»;"""1097746006093""";;"""0269.03-2012-7715743896-С-110""";
"""6731061049""";ООО «БелСтройКомплект» ;г. Ярцево;;Генеральный директор;Кисель;Дмитрий;Васильевич;;Действует;;;30.04.2014;;19.08.2014;215805, Смоленская область, г. Ярцево, пр. Металлургов, д.29, кв.72;215805, Смоленская область, г. Ярцево, пр. Металлургов, д.29, кв.72;(48143) 74721;74721;belstroy2010@yandex.ru;;Общество с ограниченной ответственностью «БелСтройКомплект»;"""1076731005482""";;"""0273.05-2014-6731061049-С-110""";
"""6730071799""";ООО «Светопрозрачные системы» ;г. Смоленск;;Директор;Иванов;Сергей;Владимирович;;Действует;;;10.05.2015;;27.02.2014;214030, г. Смоленск, Краснинское шоссе, д.41;214030, г. Смоленск, Краснинское шоссе, д.41;;;oknoff@bk.ru;;Общество с ограниченной ответственностью «Светопрозрачные системы»;"""1076731012907""";;"""0274.05-2014-6730071799-С-110""";
"""6712008593""";ООО «Родник» ;Починок;;Генеральный директор;Шапкин;Сергей;Петрович;;Действует;;;07.06.2015;;09.12.2011;216450, Смоленская обл,. г. Починок, ул. Твардовского, д. 10А;216450, Смоленская обл,. г. Починок, ул. Твардовского, д. 10А;(48149) 4-16-50;4-16-50;;;Общество с ограниченной ответственностью «Родник» Починковского района Смоленской области;"""1076712000463""";;"""0275.03-2011-6712008593-С-110""";
"""6731010189""";ОАО «ГРАЖДАНСТРОЙ» ;г. Смоленск;;Генеральный директор;Петров;Сергей;Витальевич;;Действует;;;19.06.2015;;10.12.2013;214019, г. Смоленск, Трамвайный проезд, д.14;214019, г. Смоленск, Трамвайный проезд, д.14;(4812) 555945;556391;petrov@grajdanstroy.ru;;Открытое акционерное общество «ГРАЖДАНСТРОЙ»;"""1026701420877""";;"""0276.05-2013-6731010189-С-110""";
"""6714022995""";ООО «СМОЛЕНСКСВЯЗЬСТРОЙ» ;г.Смоленск;;и.о.директора;Салов;Виктор;Анатольевич;;Действует;;;25.06.2015;;09.07.2013;214030, г.Смоленск, ул. Краснинское шоссе, д. 4;214030, г.Смоленск, ул. Краснинское шоссе, д. 4;(4812) 619199;619199;smlstroy@yandex.ru;;Общество с ограниченной ответственностью «СМОЛЕНСКСВЯЗЬСТРОЙ»;"""1036729302169""";;"""0278.05-2013-6714022995-С-110""";
"""6731064770""";ООО «ПКФ «Соффит» ;г. Смоленск;;Генеральный директор;Тюрин;Юрий;Николаевич;;Действует;;;17.06.2014;;11.09.2013;214014, г. Смоленск, ул. Твардовского, д. 14, оф. 7;214014, г. Смоленск, ул. Твардовского, д. 14, оф. 7;(4812) 590771;559234;soffit54@mail.ru;;Общество с ограниченной ответственностью «Производственно коммерческая фирма «Соффит»;"""1076731016592""";;"""0280.04-2013-6731064770-С-110""";
"""6731032320""";ООО «Теплострой» ;г. Смоленск;;директор по строительству;Бойцов;Геннадий;Иванович;;Действует;;;31.08.2015;;07.08.2013;214031, г. Смоленск, ул. Индустриальная, д. 9А;214031, г. Смоленск, ул. Индустриальная, д. 9А;(4812) 523102;;;;Общество с ограниченной ответственностью «Теплострой»;"""1026701445077""";;"""0284.02-2013-6731032320-С-110""";
"""5024028533""";ООО «Строй-Траст-Комплект» ;г. Красногорск;;главный механик;Колесников;Игорь;Александрович;;Действует;;;04.02.2015;;16.07.2014;143400, Московская область, г. Красногорск, ул. Пионерская, д. 16;143400, Московская область, г. Красногорск, ул. Пионерская, д. 16;(495) 563-09-14;563-09-14;stk95@yandex.ru;;Общество с ограниченной ответственностью «Строй-Траст-Комплект»;"""1025002863918""";;"""0286.04-2014-5024028533-С-110""";
"""6720003292""";МУП «Коммунальщик» ;с. Первомайский;;;;;;;Действует;;;13.08.2015;;23.08.2013;216426, Смоленская обл., Шумячский р-н, с. Первомайский, ул. Советская, д. 1;216426, Смоленская обл., Шумячский р-н, с. Первомайский, ул. Советская, д. 1;(48133) 26794;;;;Муниципальное унитарное предприятие «Коммунальщик» муниципального образования Первомайского сельского поселения Шумячского района Смоленской области;"""1036755050485""";;"""0287.02-2013-6720003292-С-110""";
"""400080835""";КПРСУП «Гомельоблдорстрой» ;г. Гомель;;;;;;;Действует;;;31.03.2015;;14.10.2013;246017, Республика Беларусь, г. Гомель,ул. Красноармейская, д.28;246017, Республика Беларусь, г. Гомель,ул. Красноармейская, д.28;;;;;Коммунальное проектно-ремонтно-строительное унитарное предприятие «Гомельоблдорстрой»;"""400080835""";;"""0289.02-2013-400080835-С-110""";
"""6730061984""";ООО «Паритет-Смоленск» ;г. Смоленск;;Директор;Гашин;Анатолий;Георгиевич;;Действует;;;26.01.2015;;13.06.2013;214020, г. Смоленск, ул. Шевченко, д. 83;214020, г. Смоленск, ул. Шевченко, д. 83;(4812) 318100;;;;Общество с ограниченной ответственностью «Паритет-Смоленск»;"""1066731081174""";;"""0290.03-2013-6730061984-С-110""";
"""6724007210""";ОАО «ЭлС» ;г. Десногорск;;Генеральный директор;Ольховиков;Сергей;Александрович;;Действует;;;21.10.2014;;24.07.2014;216400, Смоленская область, г. Десногорск, а/я 80/1;216400, Смоленская область, г. Десногорск, а/я 80/1;(48153) 70542;70542;elsdesnogorsk@rambler.ru;;Открытое акционерное общество «ЭлС»;"""1056700020190""";;"""0291.06-2014-6724007210-С-110""";
"""6724008630""";ООО «Радуга» ;г. Десногорск;;Генеральный директор;Нестеров;Виктор;Егорович;;Действует;;;15.11.2014;;29.08.2014;216400, Смоленская область, г. Десногорск, 6 мкр., д. 32;216400, Смоленская область, г. Десногорск, 6 мкр., д. 32;(84815) 37-44-88;37-44-88;d.raduga@yandex.ru;;Общество с ограниченной ответственностью «Радуга»;"""1096725000240""";;"""0294.04-2014-6724008630-С-110""";
"""6726504312""";ОАО «Авангард» ;г. Сафоново;;главный инженер;Зиминский;Владислав;Станиславович;;Действует;;;09.08.2014;;03.03.2011;215505, Смоленская область, г. Сафоново, ул. Октябрьская, д. 78;215505, Смоленская область, г. Сафоново, ул. Октябрьская, д. 78;(48142) 34245;34701;info@avangard-plastik.ru;;Открытое акционерное общество «Авангард»;"""1086726001614""";;"""0295.02-2011-6726504312-С-110""";
"""6730049803""";ООО «СП» ;г. Смоленск;;Директор;Семенов;Анатолий;Михайлович;;Действует;;;30.11.2014;;07.11.2013;214020, г. Смоленск, ул. Шевченко, д.79, оф.216;214020, г. Смоленск, ул. Шевченко, д.79, оф.216;;;;;Общество с ограниченной ответственностью «СП»;"""1036758323810""";;"""0296.02-2013-6730049803-С-110""";
"""6730009173""";ООО «Агрожилстрой» ;г. Смоленск;;Директор;Косых;Вячеслав;Федорович;;Действует;;;09.12.2014;;05.10.2012;214014, г. Смоленск, ул. Энгельса, 23-А;214014, г. Смоленск, ул. Энгельса, 23-А;(4812) 552363;552363;;;Общество с ограниченной ответственностью «Агрожилстрой»;"""1026701457562""";;"""0300.02-2012-6730009173-С-110""";
"""6724006791""";ООО «Стройизоляция» ;г. Десногорск;;Директор;Стародубцев;Анатолий;Вячеславович;;Действует;;;28.06.2014;;24.12.2010;216400, Смоленская область, г. Десногорск, 4-й микрорайон, д. 4, кв. 102;216400, Смоленская область, г. Десногорск, 4-й микрорайон, д. 4, кв. 102;(8153) 31404;33576;stroyizolyaciya@mail.ru;;Общество с ограниченной ответственностью «Стройизоляция»;"""1036700003680""";;"""0301.01-2010-6724006791-С-110""";
"""6730000614""";ООО «ТАУ-С» ;г. Смоленск;;Генеральный директор;Макаров;Николай;Николаевич;;Действует;;;31.08.2015;;24.12.2010;214019, г. Смоленск, мкр. Южный, д. 4;214019, г. Смоленск, мкр. Южный, д. 4;(4812) 418040;418669;tau-s@rambler.ru;;Общество с ограниченной ответственностью «ТАУ-С»;"""1026701438686""";;"""0302.01-2010-6730000614-С-110""";
"""6731038586""";ООО «Гарант-Жилье» ;г. Смоленск;;Директор;Мирошниченко;Виктор;Кимович;;Действует;;;20.03.2015;;16.02.2011;214014, г. Смоленск, ул. Исаковского, д. 5, кв. 202;214014, г. Смоленск, ул. Исаковского, д. 5, кв. 202;(4812) 329800;386950;;;Общество с ограниченной ответственностью агентство недвижимости «Гарант-Жилье»;"""1026701426553""";;"""0305.02-2011-6731038586-С-110""";
"""6722024636""";ООО «ЖилСтройСервис» ;г. Вязьма;;Директор;Камзалов;Владимир;Александрович;;Действует;;;09.02.2014;;19.06.2014;215110, Смоленская область, г. Вязьма, ул. Кронштадская, д. 111;215110, Смоленская область, г. Вязьма, ул. Кронштадская, д. 111;(48135) 41669;41669;okna_trocal_gag@mail.ru;;Общество с ограниченной ответственностью «ЖилСтройСервис»;"""1096722001640""";;"""0306.10-2014-6722024636-С-110""";
"""6730086724""";ООО «СмоленскЭнергоСтрой» ;г. Смоленск;;исполнительный директор;Васильева;Валентина;Гавриловна;;Действует;;;20.06.2015;;27.09.2013;214000, г. Смоленск, ул. Бакунина, д. 7Б;214000, г. Смоленск, ул. Бакунина, д. 7Б;(4812) 656527;386533;;;Общество с ограниченной ответственностью «СмоленскЭнергоСтрой»;"""1106731003455""";;"""0307.02-2013-6730086724-С-110""";
"""790488399""";ЗАО «Энерго Ремонт Сервис» ;г. Бобруйск;;Директор;Питков;Михаил;Михайлович;;Приостановлен;;;22.07.2014;;;213823, Республика Беларусь, Могилевская обл., Первомайский район, г. Бобруйск, ул. Орловского, д. 25Б, корп. 5;213823, Республика Беларусь, Могилевская обл., Первомайский район, г. Бобруйск, ул. Орловского, д. 25Б, корп. 5;(80225) 473413;473413;energoremserv17@mail.ru;;Закрытое акционерное общество «Энерго Ремонт Сервис»;"""790488399""";;"""0310.01-2011-790488399-С-110""";
"""6714030940""";ОАО «Дорожное эксплуатационное предприятие № 47» ;;;;;;;;Действует;;;16.05.2015;;31.03.2011;214512, Смоленская область, Смоленский район, п/о Талашкинcкое, д. ДРСУ-1;214512, Смоленская область, Смоленский район, п/о Талашкинcкое, д. ДРСУ-1;(4812) 361144;361144;dep47@keytown.com;;Открытое акционерное общество «Дорожное эксплуатационное предприятие № 47»;"""1106714000370""";;"""0312.01-2011-6714030940-С-110""";
"""6731050488""";ООО «ИТЦ» ;г. Смоленск;;Директор;Елисеева;Марина;Николаевна;;Действует;;;21.03.2015;;17.09.2014;214014, г. Смоленск, ул. Чаплина, д. 7/20;214014, г. Смоленск, ул. Чаплина, д. 7/20;(4812) 647919;647919;itcptpo@mail.ru;www.itc67.ru;Общество с ограниченной ответственностью «Информационно-технический центр»;"""1056758376102""";;"""0313.04-2014-6731050488-С-110""";
"""6712009477""";ООО «Хиславичи-Жилищник» ;п. Хиславичи;;;;;;;Действует;;;14.06.2015;;25.10.2013;216620, Смоленская область, п. Хиславичи, ул. Ленина, д. 47;216620, Смоленская область, п. Хиславичи, ул. Ленина, д. 47;(48140) 21494;21780;;;Общество с ограниченной ответственностью «Хиславичи-Жилищник»;"""1106712000317""";;"""0315.03-2013-6712009477-С-110""";
"""700408291""";ООО «Унитерм» ;г. Могилев;;;;;;;Действует;;;25.05.2015;;07.11.2013;212013, Республика Беларусь, г. Могилев, ул. Славгородское шоссе, д. 44А;212013, Республика Беларусь, г. Могилев, ул. Славгородское шоссе, д. 44А;(0222) 478595;478757;uniterm-k@yandex.ru;;Общество с ограниченной ответственностью «Унитерм»;"""700408291""";;"""0319.02-2013-700408291-С-110""";
"""300000398""";ОАО «Дорожно-строительный трест №1, г. Витебск» ;г. Витебск;;;;;;;Действует;;;25.05.2015;;04.10.2013;210026, Республика Беларусь, г. Витебск, ул. Суворова, д. 16;210026, Республика Беларусь, г. Витебск, ул. Суворова, д. 16;(10375) 221374561;212372115;dst1@dor.mtk.by;;Открытое акционерное общество «Дорожно-строительный трест №1, г. Витебск»;"""300000398""";;"""0321.03-2013-300000398-С-110""";
