ИНН;Краткое наименование;Город;Регион;Должность руководителя;Фамилия руководителя;Имя руководителя;Отчество руководителя;Сумма генподряда;Статус в СРО;Статус торгов;Членские взносы;Страхвка;Проверка;Допуск выдан;Юридический адрес;Фактический адрес;Телефон;Факс;E-mail;Веб-сайт;Полное наименование;ОГРН;КПП;Номер свидетельства;Виды работ
"""6704007388""";ООО «Строитель-Р» ;п. Верхнеднепровский;;Генеральный директор;Манукян;Саргис;Нарибекович;;Исключен;;;31.12.2013;;31.05.2013;215750, Смоленская обл., Дорогобужский р-н, п. Верхнеднепровский, ул. Ленина;215750, Смоленская обл., Дорогобужский р-н, п. Верхнеднепровский, ул. Ленина;(48144) 5-90-03;5-13-97;Stroitel-R@mail.ru;;Общество с ограниченной ответственностью «Строитель-Р»;"""1026700535718""";;"""0090.04-2013-6704007388-С-110""";
"""6731057564""";ООО «Железнодорожная компания» ;г. Смоленск;;Директор;Пухтеев;Сергей;Николаевич;;Исключен;;;25.03.2014;;26.03.2013;214031, г. Смоленск, ул. Индустриальная, д. 5;214031, г. Смоленск, ул. Индустриальная, д. 5;(4812) 429784;;zdk67@yandex.ru;;Общество с ограниченной ответственностью «Железнодорожная компания»;"""1066731111303""";;"""0094.06-2013-6731057564-С-110""";
"""7719273955""";ООО «Техстрой» ;г. Смоленск;;Генеральный директор;Бахрах;Александр;Аркадьевич;;Исключен;;;20.07.2014;;18.03.2013;214019, г. Смоленск, проезд Маршала Конева, д. 28 е;214019, г. Смоленск, проезд Маршала Конева, д. 28 е;(4812) 325194;325190;ourhome@mail.ru;;Общество с ограниченной ответственностью «Техстрой»;"""1037719028522""";;"""0101.06-2013-7719273955-С-110""";
"""6730058780""";ООО «Управление отделочных работ - 1» ;г. Смоленск;;Директор;Рудина;Мария;Ивановна;;Исключен;;;17.11.2014;;06.10.2010;214015, г. Смоленск, пер. 2-ой Краснофлотский, д.26;214015, г. Смоленск, пер. 2-ой Краснофлотский, д.26;(4812) 622576;;;;Общество с ограниченной ответственностью «Управление отделочных работ - 1»;"""1056758422456""";;"""0102.02-2010-6730058780-С-110""";
"""6730008204""";ООО «МеТаСтрой» ;г. Смоленск;;Генеральный директор;Меркин;Марк;Борисович;;Исключен;;;31.12.2012;;26.12.2009;214030, г. Смоленск, Краснинское шоссе, д. 35А;214030, г. Смоленск, Краснинское шоссе, д. 35А;(4812) 666315;666315;;;Общество с ограниченной ответственностью фирма «МеТаСтрой»;"""1026701432735""";;"""0104-2009-6730008204-67С-01""";
"""6730043512""";ООО «Рокада Плюс» ;г. Смоленск;;Директор;Шмигельский;Евгений;Васильевич;;Исключен;;;20.03.2014;;01.01.2009;214030, г. Смоленск, ул. Нормандии-Неман, д. 23Б/80;214030, г. Смоленск, ул. Нормандии-Неман, д. 23Б/80;(4812) 650126;669800;Shmigelsky_67@mail.ru;;Общество с ограниченной ответственностью «Рокада Плюс»;"""1026701458354""";;"""0105-2009-6730043512-67С-01""";
"""6730063220""";ООО «Электромонтажник» ;г. Смоленск;;Директор;Жериков;Николай;Тимофеевич;;Исключен;;;16.05.2014;;05.10.2010;214030, г. Смоленск, Краснинское шоссе, д.19 А;214030, г. Смоленск, Краснинское шоссе, д.19 А;(4812) 35-80-87;35-80-87;89107825227@mail.ru;;Общество с ограниченной ответственностью «Электромонтажник»;"""1066731101942""";;"""0106.02-2010-6730063220-С-110""";
"""6731036532""";ООО «Электромонтаж-С» ;г. Смоленск;;Директор;Ступин;Сергей;Николаевич;;Исключен;;;31.12.2013;;23.11.2012;214031, г. Смоленск, ул. 25 Сентября, д. 28А;214031, г. Смоленск, ул. 25 Сентября, д. 28А;(4812) 450390;4501009;elektromontag_S@pochta.ru;;Общество с ограниченной ответственностью «Электромонтаж-С»;"""1026701421911""";;"""0108.04-2012-6731036532-С-110""";
"""6726000185""";ОГУП «Сафоновское дорожное ремонтно-строительное управление» ;Барановское сельское поселение;;Директор;Поляков;Виктор;Васильевич;;Исключен;;;31.12.2012;;01.01.2010;215500, Смоленская область, Сафоновский район, Барановское сельское поселение ДРСУ;215500, Смоленская область, Сафоновский район, Барановское сельское поселение ДРСУ;41984;;;;Областное государственное унитарное предприятие «Сафоновское дорожное ремонтно-строительное управление»;"""1026700945589""";;"""0110-2010-6726000185-67С-03""";
"""6723000701""";СОГУП «Гагаринское дорожное ремонтно-строительное управление» ;г. Гагарин;;Директор;Боровков;Сергей;Иванович;;Исключен;;;04.04.2013;;05.10.2010;215010, Смоленская обл., г. Гагарин, ул. Гагарина, д. 100;215010, Смоленская обл., г. Гагарин, ул. Гагарина, д. 100;(48135) 43665;;gagarindrsu@mail.ru;;Смоленское областное государственное унитарное предприятие «Гагаринское дорожное ремонтно-строительное управление»;"""1026700886607""";;"""0112.02-2010-6723000701-С-110""";
"""6705000441""";СОГУП «Духовщинское дорожное ремонтно-строительное управление» ;г. Духовщина;;Директор;Белов;Владимир;Иванович;;Исключен;;;18.05.2013;;05.10.2010;216200, Смоленская обл., г. Духовщина, ул. Смоленская, д. 141;216200, Смоленская обл., г. Духовщина, ул. Смоленская, д. 141;(48166) 41741;;;;Смоленское областное государственное унитарное предприятие «Духовщинское дорожное ремонтно-строительное управление»;"""1026700975146""";;"""0113.02-2010-6705000441-С-110""";
"""6731029165""";ЗАО «Жилстрой» ;г. Смоленск;;Директор;Петрачков;Сергей;Сергеевич;;Исключен;;;31.12.2013;;01.12.2010;214019, г. Смоленск, ул. Крупской, д.64А;214019, г. Смоленск, ул. Крупской, д.64А;;;gl-1@yandex.ru;;Закрытое акционерное общество «Жилстрой»;"""1026701431261""";;"""0115.02-2010-6731029165-С-110""";
"""700200537""";ОАО «Строительный трест №12» ;г. Могилев;;Генеральный директор;Морозов;Дмитрий;Сергеевич;;Исключен;;;;;17.02.2010;212030, Республика Беларусь, г. Могилев, ул. Болдина, 11;212030, Республика Беларусь, г. Могилев, ул. Болдина, 11;;;trest12@mogilev.by;;Открытое акционерное общество «Строительный трест №12»;"""700200537""";;"""0121-2010-700200537-67С-01""";
"""6724004040""";ООО «Автограф-В» ;г. Десногорск;;Генеральный директор;Востриков;Александр;Сергеевич;;Исключен;;;10.01.2014;;01.12.2010;216400, Смоленская область, г. Десногорск, 3-й микрорайон, д.7, кв. 28;216400, Смоленская область, г. Десногорск, 3-й микрорайон, д.7, кв. 28;(48153) 33138;73504;avtograf_w@mail.ru;;Общество с ограниченной ответственностью «Автограф-В»;"""1026700924579""";;"""0123.02-2010-6724004040-С-110""";
"""5032071821""";ООО «АМАЛЬГАМА-МТСФ» ;г. Одинцово;;Директор;Шукалов;Владимир;Иванович;;Исключен;;;31.12.2011;;01.01.2009;143000, Московская область, г. Одинцово, ул. Западная, д.13;143000, Московская область, г. Одинцово, ул. Западная, д.13;(4812) 381657;381657;amalgama-mtsf@mail.ru;;Общество с ограниченной ответственностью «АМАЛЬГАМА-МТСФ»;"""1035006457012""";;"""0125-2009-5032071821-67С-03""";
"""7714575293""";ООО «ВК Сервис» ;г. Москва;;Генеральный директор;Коновалов;Антон;Николаевич;;Исключен;;;06.12.2013;;01.12.2010;125284, г. Москва, ул. Беговая, д. 13/2;125284, г. Москва, ул. Беговая, д. 13/2;(495) 7994903;1516430;antonkon@yandex.ru;;Общество с ограниченной ответственностью «ВК Сервис»;"""1047796823865""";;"""0126.02-2010-7714575293-С-110""";
"""6709000026""";СОГУП «Краснинское дорожное ремонтно-строительное управление» ;п. Красный;;Директор;Болоткин;Юрий;Егорович;;Исключен;;;31.12.2013;;01.01.2010;216100, Смоленская область, п. Красный, ул. Калинина, д.29;216100, Смоленская область, п. Красный, ул. Калинина, д.29;;;drsukras@mail.ru;;Смоленское областное государственное унитарное предприятие «Краснинское дорожное ремонтно-строительное управление»;"""1026700665463""";;"""0136-2010-6709000026-67С-02""";
"""6722001325""";СОГУП «Вяземское дорожное ремонтно-строительное управление» ;г. Вязьма;;Директор;Полигай;Владимир;Фомич;;Исключен;;;21.01.2013;;05.10.2010;215110, Смоленская область, г. Вязьма, ул. Комсомольская, д. 89;215110, Смоленская область, г. Вязьма, ул. Комсомольская, д. 89;41104;62467;vdsru@mail.ru;;Смоленское областное государственное унитарное предприятие «Вяземское дорожное ремонтно-строительное управление»;"""1026700851605""";;"""0137.02-2010-6722001325-С-110""";
"""6729041077""";ООО « Конструкторское бюро Смоленсктеплоэнерго» ;г. Смоленск;;Генеральный директор;Никифоров;Александр;Александрович;;Исключен;;;31.12.2013;;01.03.2013;214027, г. Смоленск, ул. Лавочкина, д. 107;214027, г. Смоленск, ул. Лавочкина, д. 107;;;;;Общество с ограниченной ответственностью « Конструкторское бюро Смоленсктеплоэнерго»;"""1076731013842""";;"""0141.03-2013-6729041077-С-110""";
"""7707583293""";ООО «Монолит» ;г. Москва;;Генеральный директор;Бураков;Александр;Антонович;;Исключен;;;31.12.2011;;01.01.2010;117312, г. Москва, ул. Вавилова, д.13, стр.7;117312, г. Москва, ул. Вавилова, д.13, стр.7;;;;;Общество с ограниченной ответственностью «Монолит»;"""1067746464719""";;"""0090-2009-6704007388-67С-01""";
"""6731053827""";ООО «Рем Строй Альянс» ;г. Смоленск;;Директор;Поляков;Виталий;Викторович;;Исключен;;;03.06.2014;;30.11.2012;214020, г. Смоленск, ул. Румянцева, д. 11, кв. 89;214020, г. Смоленск, ул. Румянцева, д. 11, кв. 89;(4812) 400831;209336;remstroysmolensk@inbox.ru;;Общество с ограниченной ответственностью «Рем Строй Альянс»;"""1066731023810""";;"""0147.09-2012-6731053827-С-110""";
"""6730080017""";ООО «Стройгарант-1» ;г. Смоленск;;Директор;Лысенко;Игорь;Александрович;;Исключен;;;20.01.2013;;07.09.2012;214038, г. Смоленск, ул. Гарабурды, д.15В;214038, г. Смоленск, ул. Гарабурды, д.15В;;;stroigarant_sm@mail.ru;;Общество с ограниченной ответственностью «Стройгарант-1»;"""1086731016305""";;"""0149.04-2012-6730080017-С-110""";
"""6731071449""";ООО «СтройРитм» ;г. Смоленск;;Директор;Солонец;Сергей;Анатольевич;;Исключен;;;25.03.2013;;26.03.2012;214018, г. Смоленск, ул. Памфилова, д.5;214018, г. Смоленск, ул. Памфилова, д.5;(4812) 381006;;;;Общество с ограниченной ответственностью «СтройРитм»;"""1086731014556""";;"""0152.03-2012-6731071449-С-110""";
"""6730034885""";ООО СП «Союз-2000» ;г. Смоленск;;Генеральный директор;Юрченко;Александр;Александрович;;Исключен;;;30.04.2014;;13.03.2012;214020, г. Смоленск, ул. Индустриальная, д. 4;214020, г. Смоленск, ул. Индустриальная, д. 4;(4812) 656036;656036;union_2000un@mail.ru;;Общество с ограниченной ответственностью Совместное Предприятие в форме Общества с ограниченной ответственностью «Союз-2000»;"""1026701445671""";;"""0153.06-2012-6730034885-С-110""";
"""6719000032""";СОГУП «Холм-Жирковское дорожное ремонтно-строительное управление» ;пгт. Холм-Жирковский;;;;;;;Исключен;;;31.01.2013;;14.10.2010;215650, Смоленская область, пгт. Холм-Жирковский, ул. Свердлова, д. 4;215650, Смоленская область, пгт. Холм-Жирковский, ул. Свердлова, д. 4;(48139) 22040;;;;Смоленское областное государственное унитарное предприятие «Холм-Жирковское дорожное ремонтно-строительное управление»;"""1026700948229""";;"""0156.02-2010-6719000032-С-110""";
"""6704007772""";ООО «Сантехмонтаж» ;п. Верхнеднепровский;;;;;;;Исключен;;;10.02.2014;;16.11.2010;215750, Смоленская область, Дорогобужский район, п. Верхнеднепровский, ул. Комсомольская, д.33, кв.45;215750, Смоленская область, Дорогобужский район, п. Верхнеднепровский, ул. Комсомольская, д.33, кв.45;;;;;Общество с ограниченной ответственностью «Сантехмонтаж»;"""1026700536741""";;"""0163.02-2010-6704007772-С-110""";
"""6731001956""";ОГУП «Смоленское дорожное ремонтно-строительное управление» ;д. Верховье;;Директор;Епанчинцев;Анатолий;Иванович;;Исключен;;;10.02.2014;;27.07.2012;214540, Смоленская область, Смоленский район, д. Верховье;214540, Смоленская область, Смоленский район, д. Верховье;;;Smoldrsy@rambler.ru;;Областное государственное унитарное предприятие «Смоленское дорожное ремонтно-строительное управление»;"""1026700666222""";;"""0167.05-2012-6731001956-С-110""";
"""6730085569""";ООО «Строительная Компания ОМЕГА» ;Смоленск;;Генеральный директор;Воронков;Алексей;Алексеевич;;Исключен;;;24.05.2012;;05.10.2010;214000, г. Смоленск, ул. Карла Маркса, д. 12;214000, г. Смоленск, ул. Карла Маркса, д. 12;(4812) 600-600;209336;Omega_97@mail.ru;;Общество с ограниченной ответственностью «Строительная Компания ОМЕГА»;"""1106731000320""";;"""0168.03-2010-6730085569-С-110""";
"""6729036542""";ООО «Энергостроймонтаж» ;г.Смоленск;;Директор;Короткевич;Евгений;Владимирович;;Исключен;;;31.03.2014;;14.10.2013;214014, г.Смоленск, ул.Исаковского, д. 22;214014, г.Смоленск, ул.Исаковского, д. 22;(4812) 8-925-829-75-57;38-11-40;en-str-mt@mail.ru;;Общество с ограниченной ответственностью «Энергостроймонтаж»;"""1066731111160""";;"""0173.06-2013-6729036542-С-110""";
"""6731048224""";ООО «Стройремсервис» ;г. Смоленск;;Директор;Ковалев;Виктор;Евгеньевич;;Исключен;;;20.05.2015;;14.10.2010;214019, г. Смоленск, ул. Михайловская, д.14;214019, г. Смоленск, ул. Михайловская, д.14;;;;;Общество с ограниченной ответственностью «Стройремсервис»;"""1046758340111""";;"""0178.02-2010-6731048224-С-110""";
"""6722010168""";ОАО «Вяземское управление механизации» ;г. Вязьма;;Директор;Зуев;Геннадий;Александрович;;Исключен;;;31.12.2013;;01.01.2010;215119, Смоленская область, г. Вязьма, ул. Строителей, д. 13/2;215119, Смоленская область, г. Вязьма, ул. Строителей, д. 13/2;(48131) 42945;42146;oao-vum@mail.ru;;Открытое акционерное общество «Вяземское управление механизации»;"""1026700853310""";;"""0197-2010-6722010168-67С-01""";
"""6730059382""";ООО «Энергосервисная компания 3Э-С» ;Смоленск;;Генеральный директор;Розгон;Владимир;Данилович;;Исключен;;;31.05.2013;;05.10.2010;214000, г. Смоленск, ул. Октябрьской революции, д. 9;214000, г. Смоленск, ул. Октябрьской революции, д. 9;(4812) 384742;683442;;;Общество с ограниченной ответственностью «Энергосервисная компания 3Э-С»;"""1056758442707""";;"""0198.02-2010-6730059382-С-110""";
"""6727020508""";ООО «Кипарис» ;г. Ярцево;;Генеральный директор;Гакман;Николай;Ильич;;Исключен;;;03.10.2012;;01.01.2010;215805, Смоленская область, г. Ярцево, пр. Металлургов, д. 48, кв. 24;215805, Смоленская область, г. Ярцево, пр. Металлургов, д. 48, кв. 24;(48143) 39961;;;;Общество с ограниченной ответственностью «Кипарис»;"""1096727000732""";;"""0203-2010-6727020508-67С-01""";
"""7721589755""";ООО «Проект «Двадцать Один» - Строительство» ;г. Москва;;Генеральный директор;Шихов;Анатолий;Александрович;;Исключен;;;11.02.2013;;05.10.2012;109428, г. Москва, ул. Стахановская, д. 17, стр. 1;109428, г. Москва, ул. Стахановская, д. 17, стр. 1;(495) 6889990;6889911;s@project21.ru;;Общество с ограниченной ответственностью «Проект «Двадцать Один» - Строительство»;"""5077746959373""";;"""0206.04-2012-7721589755-С-110""";
"""6729033446""";ООО «Феррум-Смоленск» ;Смоленск;;Директор;Малентарев;Валерий;Александрович;;Исключен;;;07.12.2013;;14.01.2013;214032, г. Смоленск, ул. М. Еременко, д. 18, кв. 25;214032, г. Смоленск, ул. М. Еременко, д. 18, кв. 25;(4812) 200744;200744;;;Общество с ограниченной ответственностью «Феррум-Смоленск»;"""1066731018276""";;"""0207.03-2013-6729033446-С-110""";
"""6730076187""";ООО «Смоленская проектно-строительная компания» ;г. Смоленск;;Директор;Корольков;Сергей;Юрьевич;;Исключен;;;06.06.2014;;16.04.2013;214018, г. Смоленск, Новокиевский пер., д.4Б;214018, г. Смоленск, Новокиевский пер., д.4Б;(4812) 35-86-75;35-86-75;info@smolspsk.ru;www.smolspsk.ru;Общество с ограниченной ответственностью «Смоленская проектно-строительная компания»;"""1086731005492""";;"""0211.07-2013-6730076187-С-110""";
"""7704538951""";ООО «Строительно-монтажное управление «ИНТЕРСТРОЙ» ;Москва;;;;;;;Исключен;;;19.09.2014;;16.11.2011;127473, г. Москва, 3-ий Самотечный пер., д. 11, стр.1;127473, г. Москва, 3-ий Самотечный пер., д. 11, стр.1;(495) 9560852;9563589;info@smuinterstroy.ru;;Общество с ограниченной ответственностью «Строительно-монтажное управление «ИНТЕРСТРОЙ»;"""1047796920269""";;"""0212.07-2011-7704538951-С-110""";
"""6730005203""";ООО «Скала» ;г. Смоленск;;Директор;Пискунов;Иван;Алексеевич;;Исключен;;;24.06.2014;;25.06.2012;214030, г. Смоленск, ул. Краснинское шоссе, д. 27;214030, г. Смоленск, ул. Краснинское шоссе, д. 27;(4812) 611074;611886;MURASHKINGS@RAMBLER.RU;;Общество с ограниченной ответственностью «Скала»;"""1026701445770""";;"""0214.03-2012-6730005203-С-110""";
"""6703000735""";СОГУП «Демидовское дорожное ремонтно-строительное управление» ;г. Демидов;;Директор;Моргунов;Андрей;Александрович;;Исключен;;;12.05.2013;;01.01.2010;216240, Смоленская область, г. Демидов;216240, Смоленская область, г. Демидов;(48147) 41861;42481;;;Смоленское областное государственное унитарное предприятие «Демидовское дорожное ремонтно-строительное управление»;"""4026700647379""";;"""0222-2010-6703000735-67С-01""";
"""6712000925""";СОГУП «Починковское дорожное ремонтно-строительное управление» ;г. Починок;;Директор;Тарасенков;Анатолий;Борисович;;Исключен;;;23.07.2013;;12.03.2010;216450, Смоленская область, г. Починок, ул. Победы, д.6А;216450, Смоленская область, г. Починок, ул. Победы, д.6А;(48149) 41365;;;;Смоленское областное государственное унитарное предприятие «Починковское дорожное ремонтно-строительное управление»;"""1026700632771""";;"""0223-2010-6712000925-67С-01""";
