ИНН;Краткое наименование;Город;Регион;Должность руководителя;Фамилия руководителя;Имя руководителя;Отчество руководителя;Сумма генподряда;Статус в СРО;Статус торгов;Членские взносы;Страхвка;Проверка;Допуск выдан;Юридический адрес;Фактический адрес;Телефон;Факс;E-mail;Веб-сайт;Полное наименование;ОГРН;КПП;Номер свидетельства;Виды работ
"""9909066830""";АКОО ОВЕ АРУП ЭНД ПАРТНЕРЗ ИНТЕРНЭШНЛ ЛИМИТЕД ;;;Директор филиала;Габриель;Франсис;Хайд;;Действует;;;;;14.05.2013;Фитцрой Стрит 13, Лондон WIT 4 BQ, Великобритания;Фитцрой Стрит 13, Лондон WIT 4 BQ, Великобритания;(495) 9337557;;;www.arup.com;;"""952468""";;"""0001.09-2013-9909066830-П-070""";
"""7725022205""";"ЗАО ПСО ""МОСЗАРУБЕЖСТРОЙ"" ";;;Генеральный директор;Смирнов;Валерий;Аркадьевич;;Действует;;;;;10.06.2014;121019, РФ, г. Москва, ул. Новый Арбат, д.11, стр.1;121019, РФ, г. Москва, ул. Новый Арбат, д.11, стр.1;(499) 755-20-60;;;www.pso-mzs.ru;;"""1027700022833""";;"""0002.06-2014-7725022205-П-070""";
"""7707007451""";"ЗАО ""Штрабаг"" ";;;Генеральный директор;Ортенберг;Александр;Вадимович;;Действует;;;;;02.10.2013;107031, РФ, г. Москва, ул. Петровка, д.27;107031, РФ, г. Москва, ул. Петровка, д.27;(495) 7370380;;;www.strabag.com;;"""1027700126585""";;"""0003.08-2013-7707007451-П-070""";
"""7704237658""";ООО «БУИГСТРОЙ» ;;;Генеральный директор;Решов;Алексей;Михайлович;;Действует;;;;;20.03.2013;123100, РФ, г. Москва, ул. 2-я Звенигородская, д.12, стр.2, оф.313;123100, РФ, г. Москва, ул. 2-я Звенигородская, д.12, стр.2, оф.313;(495) 7558875;;;www.bouyguesstroi.ru;;"""1027700162885""";;"""0005.04-2013-7704237658-П-070""";
"""9909028017""";ООО КОДЕСТ ИНТЕРНЕШЕНЛ ;;;Региональный;представитель;Россиньоли;Франко;;Действует;;;;;04.03.2014;33050, Поццуоло-дель-Фриули, пос. Карньякко (Провинция Удине), Виа Буттрио, Италия;33050, Поццуоло-дель-Фриули, пос. Карньякко (Провинция Удине), Виа Буттрио, Италия;(495) 9679923;;;www.codest.com;;"""01735600304""";;"""0008.07-2014-9909028017-П-070""";
"""7701717021""";ООО «СЕТЕК ИНЖ» ;;;Генеральный;директор;Аделин;Режис;;Действует;;;;;28.01.2014;115324, РФ, г. Москва, Овчинниковская набережная, д. 20, строение 2;115324, РФ, г. Москва, Овчинниковская набережная, д. 20, строение 2;(495) 6697664;;;www.setecing.ru;;"""5077746564517""";;"""0009.07-2014-7701717021-П-070""";
"""3664089153""";ЗАО «ГазСтройПроект» ;;;Генеральный директор;Савицкий;Александр;Николаевич;;Действует;;;;;16.11.2012;394006, РФ, г. Воронеж, ул. Революции 1905 года, д.82н;394006, РФ, г. Воронеж, ул. Революции 1905 года, д.82н;(4732) 623056;;;gsp.gis.ru;;"""1083668007917""";;"""0010.04-2012-3664089153-П-070""";
"""9909005860""";АО ЭМТ ЭРИМТАН МЮШАВИРЛИК ТААХХЮТ ТИДЖАРЕТ А.Ш. ;;;Глава представительства;Мехмет;Мурат;Битерге;;Действует;;;;;30.11.2012;Джиннах Джаддеси, №102/7, Чанкая, 06550, Анкара, Турция;Джиннах Джаддеси, №102/7, Чанкая, 06550, Анкара, Турция;(495) 9308981;;;www.emt.su;;"""79869""";;"""0011.03-2012-9909005860-П-070""";
"""7724815882""";ОАО «СоюзпромНИИпроект» ;;;Генеральный директор;Кузьменко;Сергей;Иванович;;Действует;;;;;18.05.2012;115487, РФ, г. Москва, ул. Садовники, д.2;115487, РФ, г. Москва, ул. Садовники, д.2;(499) 6132324;;;www.spniip.narod.ru;;"""5117746009915""";;"""0012.04-2012-7724815882-П-070""";
"""9909165260""";КОО СВАНКИ ХЭЙДЕН КОННЕЛЛ ИНТЕРНЕШНЛ ЛИМИТЕД ;;;Глава филиала компании в Москве;Дэвид;Джозеф;Хьюз;;Действует;;;;;15.02.2013;Соединенное Королевство Великобритании и Северной Ирландии, ЕС2А 2BS, г. Лондон, Кристофер Стрит, 25;Соединенное Королевство Великобритании и Северной Ирландии, ЕС2А 2BS, г. Лондон, Кристофер Стрит, 25;(495) 2585522;;;www.shca.com;;"""2222545""";;"""0016.06-2013-9909165260-П-070""";
"""7703595570""";"ЗАО ""Вест Констракшн"" ";;;Уполномоченный представитель управляющей компании;Бретодо;Янн;Лоик;;Действует;;;;;25.05.2012;125009, РФ, г.Москва, Брюсов переулок, д. 2/14, стр. 5;125009, РФ, г.Москва, Брюсов переулок, д. 2/14, стр. 5;(495) 3634655;;;www.west-construction.ru;;"""1067746666998""";;"""0017.04-2012-7703595570-П-070""";
"""7716193116""";ООО «Эксклюзивные технологии безопасности» ;;;Генеральный директор;Жигалов;Борис;Викторович;;Действует;;;;;18.05.2012;129226, РФ, г. Москва, ул. Докукина, д.17, стр. 4;129226, РФ, г. Москва, ул. Докукина, д.17, стр. 4;(499) 4769184;;;www.es-ts.ru;;"""1037739131583""";;"""0018.03-2012-7716193116-П-070""";
"""9909133678""";АО ЭНЕРГОПРОЕКТ ВИСОКОГРАДНЯ А.О. БЕЛГРАД ;;;Директор Московского;Представительства;Йовичевич;Деян;;Действует;;;;;23.04.2013;11070, Республика Сербия, г. Белград, бульвар Михаила Пупина, д.12;11070, Республика Сербия, г. Белград, бульвар Михаила Пупина, д.12;(495) 6697537;;;www.energoprojekt.rs;;"""7073151""";;"""0019.08-2013-9909133678-П-070""";
"""9909105014""";ЧООО ТЕБОДИН ИСТЕРН ЮРОП Б.В. ;;;Директор филиала;Сосновский;Андрей;Александрович;;Действует;;;;;10.02.2012;Нидерланды, Гаага, 2593BJ, Лаан Ван Ниу Оост-Инди, 25;Нидерланды, Гаага, 2593BJ, Лаан Ван Ниу Оост-Инди, 25;(495) 2588058;;;www.tebodin.com;;"""27261610""";;"""0021.07-2012-9909105014-П-070""";
"""9909007024""";АО ЕНИГЮН ИНШААТ САНАЙИ ВЕ ТИДЖАРЕТ А.Ш. ;;;Директор Московского Представительства;Мехмет;Халим;Демир;;Действует;;;;;04.03.2014;06610, Квартал Бирлик, ул. 488, дом 7, Чанкая / Анкара, Турецкая Республика;06610, Квартал Бирлик, ул. 488, дом 7, Чанкая / Анкара, Турецкая Республика;(495) 5444612;;;www.yenigun.com.tr;;"""49902""";;"""0022.05-2014-9909007024-П-070""";
"""9909048800""";ООО МАРКОН ИНЖЕНЕРГЕЗЕЛЛЬШАФТ МБХ ;;;Директор;филиала;Марин;Андре;;Действует;;;;;18.07.2012;Ханс-Хенни-Йанн-Вег 35, 22085, г.Гамбург, Федеративная Республика Германия;Ханс-Хенни-Йанн-Вег 35, 22085, г.Гамбург, Федеративная Республика Германия;(495) 9455021;;;www.marcon-ing.de;;"""HRB 27528""";;"""0023.04-2012-9909048800-П-070""";
"""6731046330""";ОАО «Смоленский промстройпроект» ;;;Генеральный директор;Баранов;Владимир;Ильич;;Действует;;;;;14.12.2012;214018, РФ, Смоленская область, г. Смоленск, ул. Кирова, дом 44;214018, РФ, Смоленская область, г. Смоленск, ул. Кирова, дом 44;(4812) 244049;;;www.psps.gis.ru;;"""1046758314151""";;"""0024.04-2012-6731046330-П-070""";
"""9909071069""";"АООО ""Юнайтед Билдинг энд Констракшн Компани Лтд"" ";;;Глава;представительства;Перич;Будимир;;Действует;;;;;25.10.2013;Комната 6, Ретфорд Энтерпрайз Сенте, Ретфорд, Ноттингхамшир, ДН22 7ДЖИР, Великобритания;Комната 6, Ретфорд Энтерпрайз Сенте, Ретфорд, Ноттингхамшир, ДН22 7ДЖИР, Великобритания;(495) 7102976;;;;;"""2727945""";;"""0025.04-2013-9909071069-П-070""";
"""9909184866""";КТ ФАМЕД ИНЖИНИРИНГ ГМБХ & КО КГ ;;;Глава филиала в;РФ;Йорг;Айзольд;;Действует;;;;;14.11.2011;1230, г. Вена, Штернгассе, д. 5, Австрийская Республика;1230, г. Вена, Штернгассе, д. 5, Австрийская Республика;(861) 2748368;;;www.vamed.com;;"""FN 162844 b""";;"""0026.04-2011-9909184866-П-070""";
"""9909155015""";АО ЭНЕРГОПРОЕКТ-ИНДУСТРИЯ АО ;;;Директор;представительства;Любисав;Попович;;Действует;;;;;16.04.2012;11070, Республика Сербия, г. Белград, бульвар Михаила Пупина, д. 12;11070, Республика Сербия, г. Белград, бульвар Михаила Пупина, д. 12;(495) 6697537;;;www.energoprojekt.rs;;"""07073224""";;"""0027.05-2012-9909155015-П-070""";
"""7733141911""";ЗАО «Блэнк Архитэктс» ;;;Генеральный директор;Чихонь;Магдалена;Анна;;Действует;;;;;15.02.2013;127473, РФ, г.Москва, ул. Краснопролетарская, д.16, стр.2;127473, РФ, г.Москва, ул. Краснопролетарская, д.16, стр.2;(499) 9735737;;;www.blankarchitects.ru;;"""1027733009974""";;"""0028.05-2013-7733141911-П-070""";
"""7705047410""";ФГУП «ВО «Технопромимпорт» ;;;Председатель ФГУП;Ильин;Виталий;Викторович;;Действует;;;;;20.03.2013;125284, РФ, г. Москва, 1-й Хорошевский проезд, д.3А, стр.2;125284, РФ, г. Москва, 1-й Хорошевский проезд, д.3А, стр.2;(495) 9400706;;;www.technopromimport.ru;;"""1037739125313""";;"""0029.05-2013-7705047410-П-070""";
"""9909258518""";ООО ЕВРОПРОЕКТ ЦИВИЛЬТЕХНИКЕР ГМБХ ;;;Глава;представительства;Антон;Мюллер;;Действует;;;;;17.01.2013;Капистрангассе 5/2/61 А-1060, г. Вена, Австрийская Республика;Капистрангассе 5/2/61 А-1060, г. Вена, Австрийская Республика;(495) 9971874;;;www.europroject.com;;"""FN 170859 p""";;"""0031.03-2013-9909258518-П-070""";
"""9909045414""";"АО ""АДП ИНЖЕНЕРИ"" ";;;Глава представительства в;Москве;Пьер;БУРЖЕН;;Действует;;;;;23.07.2013;"Франция, 91200, Атис -Монс, Аэропорт ""Орли""-Центральный парк, Южная зона, стр.641";"Франция, 91200, Атис -Монс, Аэропорт ""Орли""-Центральный парк, Южная зона, стр.641";(495) 9847393;;;www.adp-i.com;;"""431 897 081""";;"""0033.04-2013-9909045414-П-070""";
"""7701608368""";ООО «ПОРТНЕР» ;;;Генеральный;директор;Стиепич;Дарко;;Действует;;;;;21.02.2012;107996, РФ, г. Москва, ул. Гиляровского, д.65;107996, РФ, г. Москва, ул. Гиляровского, д.65;(495) 7868044;;;www.portner.ru;;"""1057747581451""";;"""0034.04-2012-7701608368-П-070""";
"""7704615959""";ООО «Эста Констракшен» ;;;Генеральный директор;Лобанов;Виктор;Васильевич;;Действует;;;;;17.09.2014;115088, РФ, г.Москва, ул.Угрешская, д.2, стр.91;115088, РФ, г.Москва, ул.Угрешская, д.2, стр.91;(495) 6654698. доб. 134;;;www.estacons.ru;;"""5067746739320""";;"""0035.07-2014-7704615959-П-070""";
"""7706210549""";ООО «Инженерное бюро Юркевича» ;;;Генеральный директор;Юркевич;Павел;Борисович;;Действует;;;;;10.10.2011;115191, РФ, г. Москва, 4-й Рощинский проезд, д.19;115191, РФ, г. Москва, 4-й Рощинский проезд, д.19;(495) 9525351;;;www.yurkevich.ru;;"""1027739320212""";;"""0039.04-2011-7706210549-П-070""";
"""7717607458""";ООО «ПроектКапитал» ;;;Генеральный директор;Дмитриев;Алексей;Юрьевич;;Действует;;;;;15.06.2012;129515, РФ, г. Москва, ул. Академика Королева, д. 4, корп. 4;129515, РФ, г. Москва, ул. Академика Королева, д. 4, корп. 4;(495) 7872063;;;;;"""1077764004207""";;"""0040.03-2012-7717607458-П-070""";
"""9909024291""";"ООО ""Транзумед ГмбХ Медицинтехник"" ";;;Глава представительства в;Москве;Александров;Ирина;;Действует;;;;;22.08.2014;Герихтсштрассе 1, 56068, г. Кобленц, Федеративная Республика Германия;Герихтсштрассе 1, 56068, г. Кобленц, Федеративная Республика Германия;(495) 5434519;;;www.transumed.de;;"""HRB 6918""";;"""0042.08-2014-9909024291-П-070""";
"""7743690212""";ООО «ТЕРРЕЛЛ» ;;;Генеральный;директор;Радонов;Радко;;Действует;;;;;18.02.2014;119049, РФ, г. Москва, переулок Спасоналивковский 1-й, д. 3/5;119049, РФ, г. Москва, переулок Спасоналивковский 1-й, д. 3/5;(926) 5166878;;;www.terrellgroup.net;;"""1087746568139""";;"""0044.07-2014-7743690212-П-070""";
"""7719597903""";ООО «БЭГ ИНЖЕНЕРИИ.РУС» ;;;Управляющий Голзио;Юге;Леонард;Оливье;;Действует;;;;;26.12.2012;119049, РФ, г.Москва, ул. Шаболовка, д.2;119049, РФ, г.Москва, ул. Шаболовка, д.2;(495) 9358571;;;www.beg-ing.com;;"""1067746859795""";;"""0045.05-2012-7719597903-П-070""";
"""3328452821""";ООО «СУ - 33» ;;;Директор;Преображенский;Владимир;Александрович;;Действует;;;;;22.08.2014;127521, РФ, г. Москва, ул. Веткина, д.2А, стр.10;127521, РФ, г. Москва, ул. Веткина, д.2А, стр.10;(4922) 472003;;;www.cy-33.ru;;"""1073328005937""";;"""0046.04-2014-3328452821-П-070""";
"""5042011412""";ЗАО «Стройсервис» ;;;Директор общества;Колойденко;Сергей;Владимирович;;Действует;;;;;03.07.2012;141315, РФ, Московская область, г. Сергиев Посад, ул. Зеленый переулок, д. 13;141315, РФ, Московская область, г. Сергиев Посад, ул. Зеленый переулок, д. 13;(495) 7862275;;;www.stroyposad.ru;;"""1035008354864""";;"""0047.05-2012-5042011412-П-070""";
"""7716198499""";"ООО ""МЕТРО-СТИЛЬ 2000"" ";;;Генеральный директор;Кривенко;Андрей;Аскольдович;;Действует;;;;;18.05.2012;129323, РФ, г.Москва, ул. Седова, д.15, корп. 2;129323, РФ, г.Москва, ул. Седова, д.15, корп. 2;(495) 6400480;;;www.metro-style.ru;;"""1027739078520""";;"""0048.04-2012-7716198499-П-070""";
"""5018068390""";"ЗАО ""Арсенал РОСТ"" ";;;Генеральный директор;Никулин;Сергей;Владимирович;;Действует;;;;;23.05.2014;141101, РФ, Московская область, г. Щелково, ул. Заводская, д. 2;141101, РФ, Московская область, г. Щелково, ул. Заводская, д. 2;(495) 7399870;;;www.arsenalrost.ru;;"""1025002042053""";;"""0049.06-2014-5018068390-П-070""";
"""7718243676""";ООО «КонтинентальЭлектро» ;;;Генеральный директор;Малюшицкий;Игорь;Леонидович;;Действует;;;;;10.10.2012;107076, РФ, г. Москва, ул. Матросская тишина, д.23, стр. 2, офис 52;107076, РФ, г. Москва, ул. Матросская тишина, д.23, стр. 2, офис 52;(495) 6170785;;;;;"""1037718019822""";;"""0050.03-2012-7718243676-П-070""";
"""7709602720""";"ООО ""ЧАПМЭН ТЭЙЛОР"" ";;;Генеральный директор;Карикова;Елена;Владимировна;;Действует;;;;;27.03.2014;119034, РФ, г. Москва, ул.Пречистенка, д.40/2, стр.2, офис XV;119034, РФ, г. Москва, ул.Пречистенка, д.40/2, стр.2, офис XV;(495) 7852717;;;www.chapmantaylor.com;;"""1057746608787""";;"""0052.07-2014-7709602720-П-070""";
"""7715573475""";"ООО ""Форт Руссиа"" ";;;Генеральный директор;Лебедева;Наталья;Борисовна;;Действует;;;;;14.05.2013;129594, РФ, г. Москва, Шереметьевская улица, д.34, помещение IX;129594, РФ, г. Москва, Шереметьевская улица, д.34, помещение IX;(495) 6019468;;;www.fort.pl;;"""1057747991498""";;"""0053.06-2013-7715573475-П-070""";
"""7705405168""";"ООО ""ТМГ ГРУП"" ";;;Генеральный;директор;Тица;Мирко;;Действует;;;;;14.12.2012;"190013, РФ, г.Санкт-Петербург, ул. Серпуховская, д.10, лит. ""А""";"190013, РФ, г.Санкт-Петербург, ул. Серпуховская, д.10, лит. ""А""";(812)6803020;;;www.tmggroup.ru;;"""1037739198199""";;"""0055.03-2012-7705405168-П-070""";
"""7709739309""";"ООО ""Блэк энд Витч РУС"" ";;;Генеральный директор;Кантор;Владимир;Ильич;;Действует;;;;;30.10.2012;109147, РФ, г. Москва, ул. Марксистская, д.16;109147, РФ, г. Москва, ул. Марксистская, д.16;(495) 2320370 доб.301;;;www.bv.com;;"""5077746783890""";;"""0056.05-2012-7709739309-П-070""";
"""9909045206""";"АОУТ ""ВИНСИ КОНСТРЮКСЬОН ГРАН ПРОЖЭ"" ";;;Директор Московского;Представительства;Бенуа;Гермонпрез;;Действует;;;;;18.09.2013;5 Кур Фердинан де Лессепс, 92500 Рюэй-Мальмэзон, Франция;5 Кур Фердинан де Лессепс, 92500 Рюэй-Мальмэзон, Франция;(499) 7068055;;;vinci.fr;;"""343 008 134""";;"""0057.05-2013-9909045206-П-070""";
"""7726563373""";"ООО ""Ситек Инжиниринг Раша"" ";;;Генеральный;директор;Магнус;Форсбак;;Действует;;;;;31.01.2013;115191, РФ, г. Москва, Гамсоновский пер., д. 5/15, стр. 2;115191, РФ, г. Москва, Гамсоновский пер., д. 5/15, стр. 2;(495) 2238678;;;www.citec.com;;"""5077746305160""";;"""0058.05-2013-7726563373-П-070""";
"""7813105556""";ООО «Стройчемини» ;;;Генеральный директор;Марченко;Гаврил;Гаврилович;;Действует;;;;;17.09.2014;191002, РФ, г. Санкт-Петербург, Владимирский проспект, д. 17, офис 31Н;191002, РФ, г. Санкт-Петербург, Владимирский проспект, д. 17, офис 31Н;(812) 3262527;;;www.quattrogemini.fi;;"""1037828004477""";;"""0060.06-2014-7813105556-П-070""";
"""7710289083""";"ООО ""Строительная фирма ""Кваттро"" ";;;Генеральный директор;Сипиляйнен;Йоуни;Илари;;Действует;;;;;29.08.2012;125009, РФ, г. Москва, Дегтярный пер., д.4, корп. 1;125009, РФ, г. Москва, Дегтярный пер., д.4, корп. 1;(495) 9701656;;;www.quattrogemini.com;;"""1027739690560""";;"""0061.06-2012-7710289083-П-070""";
"""7729544795""";"ООО ""ФАМЕД"" ";;;Директор Вагенкнехт;Фриц;Херберт;Волкер;;Действует;;;;;18.04.2014;119002, РФ, г. Москва, Малый Могильцевский переулок д. 2;119002, РФ, г. Москва, Малый Могильцевский переулок д. 2;(495) 7879017;;;www.vamed.com;;"""1067746463476""";;"""0063.06-2014-7729544795-П-070""";
"""5010018920""";ЗАО «Союзинформ» ;;;Генеральный директор;Селиванов;Максим;Викторович;;Действует;;;;;15.11.2013;170542, РФ, Тверская область, Калининский район, село Тургиново, Торговая площадь, д.1, этаж 2, комната 28;170542, РФ, Тверская область, Калининский район, село Тургиново, Торговая площадь, д.1, этаж 2, комната 28;(495) 7457131;;;www.sojuz.info;;"""1025001414020""";;"""0066.08-2013-5010018920-П-070""";
"""7736205560""";ООО «Электромонтажная компания ТСН» ;;;Генеральный директор;Иванов;Александр;Сергеевич;;Действует;;;;;05.09.2013;117997, РФ, г. Москва, ул. Профсоюзная, д.23, этаж 11, помещение 1;117997, РФ, г. Москва, ул. Профсоюзная, д.23, этаж 11, помещение 1;(495) 7804973;;;www.tsn-group.ru;;"""1027700480389""";;"""0068.06-2013-7736205560-П-070""";
"""7708196924""";ООО «Спектрум-Холдинг» ;;;Генеральный директор;Иванов;Владимир;Филиппович;;Действует;;;;;21.06.2013;129010, РФ, г.Москва, Большой Балканский пер., дом 13/47, корп. 4;129010, РФ, г.Москва, Большой Балканский пер., дом 13/47, корп. 4;(495) 9810601;;;www. spectrum-group.ru;;"""1027739331399""";;"""0069.06-2013-7708196924-П-070""";
"""7704643748""";"ООО ""ФАРМА ГРУПП"" ";;;Генеральный;директор;Владан;Вучич;;Действует;;;;;25.10.2013;119435, РФ, г.Москва, Большой Саввинский переулок, дом 11;119435, РФ, г.Москва, Большой Саввинский переулок, дом 11;(495) 9748005;;;www.pharmagroup.ru;;"""5077746476858""";;"""0071.05-2013-7704643748-П-070""";
"""7718681285""";ООО «ВЛИ Восток» ;;;Генеральный директор;Лабедан;Венсен;Эдмон;;Действует;;;;;28.01.2014;119270, РФ, г.Москва, Лужнецкая набережная д.2/4, стр. 46, офис 203;119270, РФ, г.Москва, Лужнецкая набережная д.2/4, стр. 46, офис 203;(495) 6399162;;;www.vlivostok.com;;"""1077764054477""";;"""0072.04-2014-7718681285-П-070""";
"""7735534643""";ООО «ЗАРУБЕЖПРОЕКТ» ;;;Генеральный директор;Абадеев;Андрей;Юрьевич;;Действует;;;;;30.10.2012;124460, РФ, г. Москва, Зеленоград, проезд №4806, д. 6;124460, РФ, г. Москва, Зеленоград, проезд №4806, д. 6;(495) 7800938;;;www.glavzs.ru;;"""1077761739318""";;"""0075.05-2012-7735534643-П-070""";
"""7706664782""";ООО «Мотт МакДональд Р» ;;;Генеральный директор;Панова;Светлана;Васильевна;;Действует;;;;;18.07.2014;115191, РФ, г. Москва, Гамсоновский пер., д. 5, стр. 2;115191, РФ, г. Москва, Гамсоновский пер., д. 5, стр. 2;(495) 9815665;;;www.mottmac.ru;;"""1077758264165""";;"""0076.06-2014-7706664782-П-070""";
"""7728545669""";ООО «ПИХЛЕР РУС» ;;;Генеральный;директор;Цельгер;Хансйорг;;Действует;;;;;16.04.2012;119435, РФ, г. Москва, ул. Малая Пироговская, д.18, стр.1;119435, РФ, г. Москва, ул. Малая Пироговская, д.18, стр.1;(495) 6480945;;;www.stahlbaupichler.ru;;"""1057746742680""";;"""0077.04-2012-7728545669-П-070""";
