ИНН;Краткое наименование;Город;Регион;Должность руководителя;Фамилия руководителя;Имя руководителя;Отчество руководителя;Сумма генподряда;Статус в СРО;Статус торгов;Членские взносы;Страхвка;Проверка;Допуск выдан;Юридический адрес;Фактический адрес;Телефон;Факс;E-mail;Веб-сайт;Полное наименование;ОГРН;КПП;Номер свидетельства;Виды работ
"""7706565213""";ООО «ПСО «Время-П» ;;;Генеральный директор;Хныкин;Александр;Витальевич;;Действует;;;;;06.03.2013;121087, РФ, г.Москва, ул. Заречная, д. 9;121087, РФ, г.Москва, ул. Заречная, д. 9;(499) 145-55-67, 145-62-73;;;www.vremia.su;;"""1057746056785""";;"""0078.04-2013-7706565213-П-070""";
"""7706526609""";ЗАО «ЕВРОСТРОЙ» ;;;Генеральный директор;Хижняк;Андрей;Юрьевич;;Действует;;;;;30.10.2012;121059, РФ, г. Москва, площадь Европы, д.2, офис 205;121059, РФ, г. Москва, площадь Европы, д.2, офис 205;(495) 9418460;;;www.eurostroi.ru;;"""1047796145891""";;"""0079.03-2012-7706526609-П-070""";
"""7706692557""";"ЗАО ""ИнжСтройЭксперт"" ";;;Генеральный директор;Акопов;Виталий;Робертович;;Действует;;;;;21.02.2012;121059, РФ, г. Москва, площадь Европы, д.2;121059, РФ, г. Москва, площадь Европы, д.2;(495) 6443854;;;www.is-expert.ru;;"""1087746762476""";;"""0080.03-2012-7706692557-П-070""";
"""7704595082""";"ФГУП ""ГУО МИД России"" ";;;Генеральный директор;Балебанов;Александр;Вячеславович;;Действует;;;;;30.10.2012;119200, РФ, г. Москва, Смоленская-Сенная площадь, д.32/34;119200, РФ, г. Москва, Смоленская-Сенная площадь, д.32/34;(499)9222133;;;www.guo-mid.ru;;"""1067746488413""";;"""0081.04-2012-7704595082-П-070""";
"""7715647014""";"ООО ""Экспертный центр современных коммуникаций"" ";;;Генеральный директор;Мингазеев;Мансур;Агзамович;;Действует;;;;;25.10.2013;127106, РФ, г.Москва , ул Гостиничная, дом 9, корп. 4;127106, РФ, г.Москва , ул Гостиничная, дом 9, корп. 4;(495) 4821881;;;www.insyst.net;;"""5077746714260""";;"""0082.06-2013-7715647014-П-070""";
"""5025000682""";ООО «Контакт» ;;;Директор;Кузнецова;Любовь;Александровна;;Действует;;;;;14.11.2011;141730, РФ, Московская область, г. Лобня, ул. Промышленная, дом 1Б;141730, РФ, Московская область, г. Лобня, ул. Промышленная, дом 1Б;(498) 6001418;;;www.kontakt-l.ru;;"""1025003080750""";;"""0083.04-2011-5025000682-П-070""";
"""7734527690""";ООО «ФОРМ» ;;;Генеральный директор;Иоанна;Моника;Вильк;;Действует;;;;;30.10.2012;123060, РФ, г. Москва, ул. Расплетина, д. 19, офис 2;123060, РФ, г. Москва, ул. Расплетина, д. 19, офис 2;(495) 7885421;;;www.form44.com;;"""1057747221685""";;"""0084.05-2012-7734527690-П-070""";
"""9909035247""";АО ШТРАБАГ АГ ;;;Глава;представительства;Герхард;Гритцнер;;Действует;;;;;03.07.2012;А-9800, Шпитталь-на-Драу, Ортенбургерштрассе, 27, Австрийская Республика;А-9800, Шпитталь-на-Драу, Ортенбургерштрассе, 27, Австрийская Республика;(495) 7370380;;;www.strabag.com;;"""HRB 39101""";;"""0086.04-2012-9909035247-П-070""";
"""9909282609""";АО УНИС, АО ;;;Директор Московского;Представительства;Коварж;Йиржи;;Действует;;;;;25.05.2012;Чешская Республика, г. Брно, 62400, ул. Юндровска 33;Чешская Республика, г. Брно, 62400, ул. Юндровска 33;(420) 541515111;;;www.unis.cz;;"""005 32 304""";;"""0087.04-2012-9909282609-П-070""";
"""7704225973""";ООО «АССМАНН Бератен +Планен» ;;;Генеральный;директор;Грассхофф;Ханс-Георг;;Действует;;;;;31.07.2014;119121, РФ, г.Москва, ул. Бурденко, д.14А;119121, РФ, г.Москва, ул. Бурденко, д.14А;(495) 6469731;;;www.assmann.ru;;"""1037700251797""";;"""0088.06-2014-7704225973-П-070""";
"""7726538923""";ООО «ИНТЕРНЕШНЛ ЭЛЕКТРИК» ;;;Генеральный директор;Маргарян;Виктор;Генрихович;;Действует;;;;;18.05.2012;117545, РФ, г.Москва, Варшавское шоссе, дом 125Д, корп.1, блок 2;117545, РФ, г.Москва, Варшавское шоссе, дом 125Д, корп.1, блок 2;(495) 9253455;;;www.internationalelectric.ru;;"""1067746475818""";;"""0089.05-2012-7726538923-П-070""";
"""9909274904""";ЧКОО ПРП АРХИТЕКТС ХОЛДИНГЗ ЛИМИТЕД ;;;Глава представительства Террис;Раймонд;Джеймс;Белл;;Действует;;;;;28.03.2012;Великобритания, Ферри Воркс, Саммер Роуд, Темс Диттон, Суррей, КТ7 0QJ;Великобритания, Ферри Воркс, Саммер Роуд, Темс Диттон, Суррей, КТ7 0QJ;(495) 7753527;;;www. prparchitects.co.uk;;"""2747686""";;"""0090.05-2012-9909274904-П-070""";
"""7716151652""";ООО «Универсум технолоджис» ;;;Генеральный директор;Куликов;Владимир;Александрович;;Действует;;;;;18.05.2012;129336, РФ, г.Москва, Анадырский проезд, д.61;129336, РФ, г.Москва, Анадырский проезд, д.61;(499) 4764206;;;www utsystem.ru;;"""1037739110573""";;"""0091.03-2012-7716151652-П-070""";
"""7704014940""";ООО «РУСЬ-Ст С» ;;;Генеральный директор;Харламов;Дмитрий;Васильевич;;Действует;;;;;10.10.2012;119002, РФ, г. Москва, переулок Сивцев Вражек, д. 37/16;119002, РФ, г. Москва, переулок Сивцев Вражек, д. 37/16;(499) 2413310;;;;;"""1027700505315""";;"""0092.03-2012-7704014940-П-070""";
"""7705449687""";"ООО ""КОФЕЛИ Гебойдетехник"" ";;;Генеральный директор;Сердинов;Сергей;Витальевич;;Действует;;;;;17.10.2014;115162, РФ, г. Москва, ул. Лестева, д. 18;115162, РФ, г. Москва, ул. Лестева, д. 18;(495) 9419978;;;www.cofely.ru;;"""1037700239983""";;"""0094.05-2014-7705449687-П-070""";
"""9909281732""";КОО НОРТИВА ЛТД ;;;Глава;представительства;Дробняк;Драган;;Действует;;;;;14.12.2012;Кириаку Матси, 11, Никис Центр, офис 303, 1082, Никосия, Кипр;Кириаку Матси, 11, Никис Центр, офис 303, 1082, Никосия, Кипр;(495) 6453283;;;;;"""213936""";;"""0095.03-2012-9909281732-П-070""";
"""7718723898""";"ООО ""СТРОЙМАРКЕТ"" ";;;Генеральный директор;Тиль;Алексей;Викторович;;Действует;;;;;30.10.2012;141033, РФ, Московская область, Мытищинский район, поселок городского типа Пироговский, ул Фабричная, д.1;141033, РФ, Московская область, Мытищинский район, поселок городского типа Пироговский, ул Фабричная, д.1;(499)7070222;;;;;"""5087746198250""";;"""0096.06-2012-7718723898-П-070""";
"""7701297049""";ООО «РЕЙЛЕРС» ;;;Генеральный директор;Руоконен;Петри;Танели;;Действует;;;;;14.05.2013;105082, РФ, г Москва, Переведеновский переулок, дом 13, стр.10;105082, РФ, г Москва, Переведеновский переулок, дом 13, стр.10;(495) 7873846;;;: www.lausamo.com;;"""1027739153045""";;"""0097.06-2013-7701297049-П-070""";
"""7104005180""";ЗАО «Монолит» ;;;Президент;Карасев;Александр;Иванович;;Действует;;;;;18.04.2014;300041, РФ, г.Тула ул. Путейская , д.7;300041, РФ, г.Тула ул. Путейская , д.7;(487) 2301501;;;;;"""1027100598865""";;"""0099.06-2014-7104005180-П-070""";
"""7710690094""";ООО «СТРОЙАРХИТЕКТУРА» ;;;Генеральный директор;Князев;Евгений;Николаевич;;Действует;;;;;15.06.2012;125047, РФ, г. Москва, ул. 4-я Тверская-Ямская, д. 2/11, стр. 2;125047, РФ, г. Москва, ул. 4-я Тверская-Ямская, д. 2/11, стр. 2;(495) 5809224;;;st-ar.ru;;"""1077760546665""";;"""0101.04-2012-7710690094-П-070""";
"""7724068905""";"ООО ""Бастай"" ";;;Генеральный директор;Ибрагимов;Николай;Альбертович;;Действует;;;;;18.09.2013;115477, РФ, г. Москва, Кавказский бульвар, д.36, стр.2;115477, РФ, г. Москва, Кавказский бульвар, д.36, стр.2;(495) 4238320;;;;;"""1037739036720""";;"""0102.04-2013-7724068905-П-070""";
"""5904086057""";ОАО «Институт Пермгипромашпром» ;;;Генеральный директор;Белоусов;Владимир;Васильевич;;Действует;;;;;27.04.2012;614016, РФ, Пермский край, г. Пермь, ул. Куйбышева, дом 47;614016, РФ, Пермский край, г. Пермь, ул. Куйбышева, дом 47;(342) 23931082;;;pgmp.web-box.ru,;;"""1035900510546""";;"""0103.05-2012-5904086057-П-070""";
"""7728662813""";ООО «ПРОЕКТ ГРУПП» ;;;Генеральный;директор;Лазаревич;Небойша;;Действует;;;;;25.05.2012;127576, РФ, г. Москва, ул. Новгородская, д.1, стр. 4;127576, РФ, г. Москва, ул. Новгородская, д.1, стр. 4;(499) 5025324;;;www.project-laza.ru;;"""1087746758285""";;"""0104.04-2012-7728662813-П-070""";
"""7727630880""";ООО «Промонтис» ;;;Генеральный директор;Филипчук;Юрий;Богданович;;Действует;;;;;14.05.2013;117997, РФ, г. Москва, Нахимовский проспект, дом 36;117997, РФ, г. Москва, Нахимовский проспект, дом 36;(499) 1245979;;;www.promontis.ru;;"""1077761982506""";;"""0105.04-2013-7727630880-П-070""";
"""6658155597""";ООО «Грачев и Партнеры» ;;;Директор;Грачев;Владимир;Юрьевич;;Действует;;;;;14.12.2012;620028, РФ, Свердловская область, г. Екатеринбург, ул. Долорес Ибаррури, дом 2;620028, РФ, Свердловская область, г. Екатеринбург, ул. Долорес Ибаррури, дом 2;(343) 3794590;;;www.gppb.ru;;"""1026602325617""";;"""0106.05-2012-6658155597-П-070""";
"""7708653673""";ООО «ПромстройКомпани» ;;;Президент;Лебошин;Александр;Владимирович;;Действует;;;;;06.12.2013;125493, РФ, г.Москва, ул. Авангардная, дом 3;125493, РФ, г.Москва, ул. Авангардная, дом 3;(495) 6455451;;;промстройкомпани.рф;;"""1077762366330""";;"""0107.05-2012-7708653673-П-070""";
"""7719601973""";ООО «ээ инжиниринг» ;;;Генеральный директор;Грайнер;Манфред;Франц;;Действует;;;;;17.01.2013;115432, РФ, г.Москва, проспект Андропова, д.18, корп.7;115432, РФ, г.Москва, проспект Андропова, д.18, корп.7;(499) 6830105;;;www.energieeffizienz.com;;"""5067746341603""";;"""0109.04-2013-7719601973-П-070""";
"""3905062295""";ООО «ЛЕНОКС-КАЛИНИНГРАД» ;;;Генеральный;директор;Светислав;Пулич;;Действует;;;;;26.12.2012;236000, РФ, Калининградская область, г. Калининград, ул. Проспект Мира, дом 136;236000, РФ, Калининградская область, г. Калининград, ул. Проспект Мира, дом 136;(4012) 211449;;;www.lenox.ru;;"""1043900853260""";;"""0111.04-2012-3905062295-П-070""";
"""9909033610""";ООО ЛАБ ЭНД ФАРМА, СПОЛ С.Р.О. ;;;Генеральный;директор;Илья;Брюлл;;Действует;;;;;15.06.2012;Чешская Республика, 102 00 г. Прага 10, У товарен, 1380/2ф;Чешская Республика, 102 00 г. Прага 10, У товарен, 1380/2ф;(+420) 272101411;;;;;"""158 91 194""";;"""0112.03-2012-9909033610-П-070""";
"""7704697207""";ЗАО «ГЛАВЗАРУБЕЖСТРОЙ» ;;;Генеральный директор;Ледовский;Вадим;Вячеславович;;Действует;;;;;14.11.2011;121087, РФ, г. Москва, ул. Тучковская, д. 9А;121087, РФ, г. Москва, ул. Тучковская, д. 9А;(495) 7800935;;;www.glavzs.ru.;;"""1087746976239""";;"""0113.04-2011-7704697207-П-070""";
"""7718601184""";ООО «пасмос» ;;;Генеральный;директор;Айхбергер;Петер;;Действует;;;;;27.04.2012;107031, РФ, г. Москва, ул. Петровка, д.27, подъезд 3;107031, РФ, г. Москва, ул. Петровка, д.27, подъезд 3;(495) 6410149;;;www.pasmos.com;;"""5067746439349""";;"""0114.04-2012-7718601184-П-070""";
"""9909031740""";ООО ГЛАТТ ИНЖЕНЕРТЕХНИК ;;;Глава;представительства;Циль;Детлеф;;Действует;;;;;27.01.2012;Нордштрассе д.12, 99427, Веймар, Федеративная Республика Германия;Нордштрассе д.12, 99427, Веймар, Федеративная Республика Германия;(495) 7874289;;;www.glatt.com;;"""HRB 102013""";;"""0115.05-2012-9909031740-П-070""";
"""2536057179""";ООО «Инжиниринг Консалтинг Компани» ;;;Генеральный директор;Максимец;Александра;Георгиевна;;Действует;;;;;29.08.2012;690001, РФ, Приморский край, г. Владивосток, ул. Дальзаводская, д.1;690001, РФ, Приморский край, г. Владивосток, ул. Дальзаводская, д.1;(4232) 651076;;;www.rs-consulting.ru;;"""1022501306816""";;"""0116.04-2012-2536057179-П-070""";
"""7725537733""";ООО «ВП» ;;;Генеральный;директор;Пистр;Жан;;Действует;;;;;27.04.2012;127051, РФ, г. Москва, ул. Садовая Самотечная, д.24/27;127051, РФ, г. Москва, ул. Садовая Самотечная, д.24/27;(495) 7878444;;;www.valode-et-pistre.com;;"""1057746745760""";;"""0117.05-2012-7725537733-П-070""";
"""7707718543""";ООО «КАД дизайн» ;;;Генеральный директор;Мельникова;Татьяна;Юрьевна;;Действует;;;;;20.12.2013;125040, РФ, г. Москва, ул. Нижняя, д.14, стр.1;125040, РФ, г. Москва, ул. Нижняя, д.14, стр.1;(499) 258-01-05;;;www.kaddesign.biz;;"""1107746020425""";;"""0118.04-2013-7707718543-П-070""";
"""7718662853""";ООО «СК КО-Восток» ;;;Генеральный;директор;Сежурне;Бенжамен;;Действует;;;;;27.04.2012;101000, РФ, г.Москва, ул. Покровка, д.1/13/6, стр.2, офис 35;101000, РФ, г.Москва, ул. Покровка, д.1/13/6, стр.2, офис 35;(495) 9807833;;;www.ecoenergy-group.com;;"""1077759410618""";;"""0119.03-2012-7718662853-П-070""";
"""9909095895""";КОО ПЕТРОФАК ИНТЕРНЭШНЛ ЛТД ;;;Управляющий филиала в Москве;Поддубный;Олег;Олегович;;Действует;;;;;18.05.2012;Уайтли Чемберз, Дон Стрит, Сент Хелиер, остров Джерси JE4 9WG, Великобритания;Уайтли Чемберз, Дон Стрит, Сент Хелиер, остров Джерси JE4 9WG, Великобритания;(495) 9337884;;;www.petrofac.com;;"""50698""";;"""0120.03-2012-9909095895-П-070""";
"""9909316128""";АО Линде АГ ;;;Глава;представительства;Йиржи;Кедлес;;Действует;;;;;05.09.2013;Клостерхофштрассе 1, 80331, г. Мюнхен, Федеративная Республика Германия;Клостерхофштрассе 1, 80331, г. Мюнхен, Федеративная Республика Германия;(495) 9871223;;;www.linde.com;;"""HRB 169850""";;"""0122.05-2013-9909316128-П-070""";
"""7703501050""";ООО «Хасконинг Консультанты, Архитекторы и Инженеры» ;;;Генеральный директор ван;Дайк;Этьенн;Арно;;Действует;;;;;27.03.2014;107014, РФ, г. Москва, ул. Бабаевская, д. 6;107014, РФ, г. Москва, ул. Бабаевская, д. 6;(495) 7398583;;;www.royalhaskoning.ru;;"""1037739865151""";;"""0125.10-2014-7703501050-П-070""";
"""7704563926""";ООО «Инженерное бюро Цаммит» ;;;Генеральный;директор;Соколовски;Давид;;Действует;;;;;26.06.2014;125040, РФ, г. Москва, 3-я ул.Ямского Поля, д.18;125040, РФ, г. Москва, 3-я ул.Ямского Поля, д.18;(495) 9262343;;;www.ib-zammit.ru;;"""1057747525736""";;"""0128.05-2014-7704563926-П-070""";
"""7703548682""";ООО «РАСЭН СТРОЙ» ;;;Генеральный;директор;Ренде;Ахмет;;Действует;;;;;18.09.2013;123610, РФ, г. Москва, Краснопресненская наб., д.12, ЦМТ, 6-й подъезд, офис 1627;123610, РФ, г. Москва, Краснопресненская наб., д.12, ЦМТ, 6-й подъезд, офис 1627;(495) 9670606;;;www.rasen.ru;;"""1057746728929""";;"""0129.04-2013-7703548682-П-070""";
"""7734237750""";ООО «СпецЭлектроМонтаж-5» ;;;Генеральный директор;Сербулев;Валерий;Дмитриевич;;Действует;;;;;25.11.2011;119034, РФ, г. Москва, ул. Пречистенка, д.28;119034, РФ, г. Москва, ул. Пречистенка, д.28;(495) 6506495;;;;;"""1027739404098""";;"""0130.03-2011-7734237750-П-070""";
"""7723645010""";ООО «БИРО 71» ;;;Генеральный;директор;Николич;Вукое;;Действует;;;;;18.02.2014;115114, РФ, г. Москва, Даниловская набережная, д. 4, стр.15;115114, РФ, г. Москва, Даниловская набережная, д. 4, стр.15;(495) 9813117;;;;;"""1087746090662""";;"""0131.04-2014-7723645010-П-070""";
"""9909249030""";АО ИСТРОЭНЕРГО ГРОУП, АО ;;;Директор;филиала;Эва;Рангель;;Действует;;;;;19.09.2012;Словакия, 934 01, г. Левице, ул. Розмаринова, д.4;Словакия, 934 01, г. Левице, ул. Розмаринова, д.4;(812) 4067750;;;www.ieg.sk;;"""36 518 531""";;"""0132.05-2012-9909249030-П-070""";
"""7703661529""";ООО «Тернер энд Таунсенд» ;;;Генеральный директор;Грэйс;Пол;Джеймс;;Действует;;;;;18.07.2012;125009, РФ, г. Москва, Б.Никитская ул., д.12-12А/1, стр.1, подъезд 2;125009, РФ, г. Москва, Б.Никитская ул., д.12-12А/1, стр.1, подъезд 2;(495) 2238650;;;turnerandtownsend.com;;"""1087746428571""";;"""0135.04-2012-7703661529-П-070""";
"""7705586323""";ООО «ЮГЕН-Т» ;;;Генеральный;директор;Николич;Радомир;;Действует;;;;;20.11.2013;115054, РФ, г. Москва, Озерковская набережная, д. 48-50, стр.1;115054, РФ, г. Москва, Озерковская набережная, д. 48-50, стр.1;(499) 1803180;;;"www.yugent.ru;";;"""1047796140908""";;"""0137.03-2013-7705586323-П-070""";
"""9909207104""";ООО Линде Инжиниринг Дрезден ГмбХ ;;;Глава представительства в;РФ;Йиржи;Кедлес;;Действует;;;;;24.10.2011;Боденбахер Штрассе 80, 01277 Дрезден, Федеративная Республика Германия;Боденбахер Штрассе 80, 01277 Дрезден, Федеративная Республика Германия;(495) 9871223;;;www.linde.com;;"""HRB 1518""";;"""0139.04-2011-9909207104-П-070""";
"""7710336618""";ООО «Д.М. Инжиниринг» ;;;Генеральный директор;Мензис;Дуглас;Маккей;;Действует;;;;;21.02.2012;103009, РФ, г. Москва, Тверская ул, д.10, стр.3;103009, РФ, г. Москва, Тверская ул, д.10, стр.3;(495) 7376023;;;www.dmek.ru;;"""1037700163380""";;"""0140.03-2012-7710336618-П-070""";
"""7721636081""";ООО «ФЛЮИДОТЕК ВОСТОК» ;;;Генеральный директор;Сабурова;Лариса;Александровна;;Действует;;;;;04.03.2014;109202, РФ, г. Москва, шоссе Фрезер, д. 5/1, помещение 1, комната 19;109202, РФ, г. Москва, шоссе Фрезер, д. 5/1, помещение 1, комната 19;(495) 6171408;;;;;"""5087746297359""";;"""0141.04-2014-7721636081-П-070""";
"""6320013151""";ООО «РОМЕКС - ПС» ;;;Директор;Куракин;Владислав;Юрьевич;;Действует;;;;;10.10.2012;445043, РФ, Самарская обл., г. Тольятти, ул. Вокзальная, д.54;445043, РФ, Самарская обл., г. Тольятти, ул. Вокзальная, д.54;(8482) 207788;;;www.romex-ib.com;;"""1026301983740""";;"""0142.03-2012-6320013151-П-070""";
"""7704037264""";ЗАО «ПЕРГАМОС» ;;;Генеральный директор;Петросян;Тигран;Робертович;;Действует;;;;;26.12.2012;119034, РФ, г. Москва, Соймоновский пр, д.5, стр.2;119034, РФ, г. Москва, Соймоновский пр, д.5, стр.2;(499) 9732227;;;www.pergamos.ru;;"""1027739055739""";;"""0143.04-2012-7704037264-П-070""";
"""7710723952""";ЗАО «ЭйЭйчАр Архитектс» ;;;Генеральный;директор;Майкл;Кус;;Действует;;;;;18.07.2014;125009, РФ, г. Москва, ул. Большая Никитская, д. 12, стр.1;125009, РФ, г. Москва, ул. Большая Никитская, д. 12, стр.1;(495) 629-90-71, 629-90-83;;;www.ahr-global.com;;"""1087746861180""";;"""0144.05-2014-7710723952-П-070""";
"""7729117803""";ООО ПКП «Вэлко-2000» ;;;Генеральный директор;Чичиков;Игорь;Евгеньевич;;Действует;;;;;06.03.2012;117415, РФ, г. Москва, Проспект Вернадского, д.59А;117415, РФ, г. Москва, Проспект Вернадского, д.59А;(495) 5140419;;;www.velko.ru;;"""1027739386938""";;"""0145.03-2012-7729117803-П-070""";
"""7731516940""";ООО «ПРОМЭНЕРГО ИНЖИНИРИНГ» ;;;Генеральный;директор;Станишич;Душан;;Действует;;;;;20.09.2011;119313, РФ, г. Москва, Ленинский проспект, д.93, корп.2;119313, РФ, г. Москва, Ленинский проспект, д.93, корп.2;(495) 9731765;;;;;"""1047796926760""";;"""0147.03-2011-7731516940-П-070""";
"""7701619017""";ООО «Дреес и Зоммер» ;;;Генеральный;директор;Зендлер;Штеффен;;Действует;;;;;21.06.2013;105064, г. Москва, ул. Земляной Вал, д.9;105064, г. Москва, ул. Земляной Вал, д.9;(495) 7923092;;;www.dreso.com;;"""1057748368369""";;"""0148.04-2013-7701619017-П-070""";
"""9909018940""";ООО КОНЦЕПТ 90 О.О.О. ;;;"";Директор;Шарин;Давор;;Действует;;;;;10.02.2012;Республика Хорватия, 10000, г. Загреб, 5 Равнице б.н.;Республика Хорватия, 10000, г. Загреб, 5 Равнице б.н.;(495) 6370184;;;www.concept90.ru;;"""080086092""";;"""0149.03-2012-9909018940-П-070""";
