ИНН;Краткое наименование;Город;Регион;Должность руководителя;Фамилия руководителя;Имя руководителя;Отчество руководителя;Сумма генподряда;Статус в СРО;Статус торгов;Членские взносы;Страхвка;Проверка;Допуск выдан;Юридический адрес;Фактический адрес;Телефон;Факс;E-mail;Веб-сайт;Полное наименование;ОГРН;КПП;Номер свидетельства;Виды работ
"""7731541030""";ООО «КЛИМАТЭЛЬ» ;;;Генеральный;директор;Себастьен;Мартин;;Действует;;;;;25.05.2012;121471, РФ, г. Москва, Можайское шоссе, д. 29/2, стр. 1;121471, РФ, г. Москва, Можайское шоссе, д. 29/2, стр. 1;(495) 6275516;;;www.Klimatel.ru;;"""1067746454379""";;"""0150.03-2012-7731541030-П-070""";
"""5007004469""";ООО «Корнет» ;;;Генеральный директор;Азаров;Михаил;Павлович;;Действует;;;;;20.09.2011;141800, РФ, Московская область, г. Дмитров, ул. Промышленная, д.25;141800, РФ, Московская область, г. Дмитров, ул. Промышленная, д.25;(496) 223 89 58;;;;;"""1035001601986""";;"""0151.02-2011-5007004469-П-070""";
"""7709796723""";ЗАО КПИИ «ГИДРОЭНЕРГОПРОЕКТ ;;;Генеральный директор;Кочнев;Валерий;Михайлович;;Действует;;;;;04.03.2014;115114, РФ, г. Москва, ул. Летниковская, д.11/10, строение 3;115114, РФ, г. Москва, ул. Летниковская, д.11/10, строение 3;(499) 2721284;;;www.gidep-kpii.ru;;"""1087746769087""";;"""0152.05-2014-7709796723-П-070""";
"""7703679276""";ООО «РАСЭН Строй Трейд» ;;;Генеральный;директор;Озер;Левент;;Действует;;;;;18.09.2013;123058, РФ, г. Москва, ул. Грузинская Большая, д.69, этаж 2, помещ.1, комн.22;123058, РФ, г. Москва, ул. Грузинская Большая, д.69, этаж 2, помещ.1, комн.22;(495) 5445700;;;www.rasen.ru;;"""5087746402200""";;"""0154.05-2013-7703679276-П-070""";
"""7703544783""";ООО «Пошвыкин Группа» ;;;Генеральный директор;Лукьянова;Елена;Анатольевна;;Действует;;;;;30.11.2012;117292, РФ, г. Москва, ул Кржижановского, д.5, корп.3, кв.18;117292, РФ, г. Москва, ул Кржижановского, д.5, корп.3, кв.18;(495) 6092622;;;;;"""1057746411843""";;"""0155.04-2012-7703544783-П-070""";
"""5029129239""";ООО ИСЦ «С.О.В.А. СТ» ;;;Генеральный директор;Петрова;Светлана;Валентиновна;;Действует;;;;;26.12.2012;141008, РФ, Московская область, г. Мытищи, Летная ул., д.3/15;141008, РФ, Московская область, г. Мытищи, Летная ул., д.3/15;(495) 7684743;;;www.sova-st.rf;;"""1095029007028""";;"""0156.03-2012-5029129239-П-070""";
"""7709637635""";ООО «Три Моря Констракшн и Трейд Компани» ;;;Генеральный;директор;Герен;Мурат;;Действует;;;;;14.11.2011;115114, РФ, г. Москва, 1-й Кожевнический пер., д.6, стр.6;115114, РФ, г. Москва, 1-й Кожевнический пер., д.6, стр.6;(495) 2320037;;;www.trimorya.ru;;"""1057748673630""";;"""0157.02-2011-7709637635-П-070""";
"""3327836960""";ООО «С-Проект» ;;;Генеральный директор;Гаврилова;Татьяна;Игоревна;;Действует;;;;;16.11.2012;600001, РФ, Владимирская обл., г. Владимир, ул. Диктора Левитана, д.1;600001, РФ, Владимирская обл., г. Владимир, ул. Диктора Левитана, д.1;(84922) 371323;;;sprojectrus.ru;;"""1083327002109""";;"""0160.03-2012-3327836960-П-070""";
"""7707319940""";ООО «ПИ-ЭМ ГРУП ВОСТОК» ;;;Генеральный;директор;Чарльз;Махон;;Действует;;;;;18.02.2014;127055, РФ, г. Москва, ул. Бутырский Вал, д.68/70, стр.1;127055, РФ, г. Москва, ул. Бутырский Вал, д.68/70, стр.1;(495) 7294740;;;www.pmgroup-global.com;;"""1037707009438""";;"""0162.05-2014-7707319940-П-070""";
"""7701747001""";ООО «ЙЕП СТРОЙ» ;;;Генеральный директор;Демир;Мехмет;Халим;;Действует;;;;;10.10.2012;107078, РФ, г. Москва, ул. Новая Басманная, д. 4-6, стр.3;107078, РФ, г. Москва, ул. Новая Басманная, д. 4-6, стр.3;(495) 5444612;;;www.yenigun.com.tr;;"""1077760841003""";;"""0163.03-2012-7701747001-П-070""";
"""9909193821""";ООО НИРСБЕРГЕР СЛОВАКИЯ ООО ;;;Директор;филиала;Лаш;Зденек;;Действует;;;;;22.12.2011;01001, Словакия, г. Жилина, Бытчицка цеста 82;01001, Словакия, г. Жилина, Бытчицка цеста 82;(495) 2501350;;;www.niersberger.eu;;"""36 390 071""";;"""0166.02-2011-9909193821-П-070""";
"""7703617713""";ООО «БАУЭР Технология» ;;;Генеральный;директор;Бёниш;Марио;;Действует;;;;;25.10.2013;119119, РФ, г. Москва, Ленинский проспект, д.42, корп.1-2-3, оф.1;119119, РФ, г. Москва, Ленинский проспект, д.42, корп.1-2-3, оф.1;(495) 6639391;;;www.rusbauer.ru;;"""1067760340823""";;"""0167.04-2013-7703617713-П-070""";
"""9909045397""";ООО ЭМ ИНЖИНИРИНГ ООО, Белград ;;;"";Директор;Милутинович;Любиша;;Действует;;;;;26.12.2012;Республика Сербия, г. Белград, ул. Веле Нигринове, д.16а;Республика Сербия, г. Белград, ул. Веле Нигринове, д.16а;(495) 6882623;;;;;"""1-79715-00""";;"""0169.02-2012-9909045397-П-070""";
"""9909040744""";АКЗТ БРИСАЙЗ ТРЕЙДИНГ ЛИМИТЕД ;;;"";Директор;Сладоевич;Ратко;;Действует;;;;;31.01.2013;1, Хрисанту Милона Стрит, Панаидес Билдинг 4 этаж, офис 1, Лимассол;1, Хрисанту Милона Стрит, Панаидес Билдинг 4 этаж, офис 1, Лимассол;(499) 1478518;;;;;"""81008""";;"""0170.02-2013-9909040744-П-070""";
"""9909332232""";ООО энергиэффициенц ГмбХ ;;;Директор;представительства;Марио;Таухер;;Действует;;;;;26.12.2012;1030 Вена, Марокканергассе 16, Австрийская Республика;1030 Вена, Марокканергассе 16, Австрийская Республика;(499) 6830105;;;www.energieeffizienz.com;;"""25 3237 h""";;"""0171.02-2012-9909332232-П-070""";
"""9909088626""";АО СНЕФ ;;;Директор;филиала;Стефан;Кортель;;Действует;;;;;16.11.2012;Франция, 13015, г. Марсель, авеню дез Эгалад, 87;Франция, 13015, г. Марсель, авеню дез Эгалад, 87;(495) 6654916;;;www.snef.ru;;"""056 800 659""";;"""0172.02-2012-9909088626-П-070""";
"""7708176124""";ЗАО «Гортехпроектпоставка» ;;;Генеральный директор;Соколов;Владимир;Юрьевич;;Действует;;;;;15.06.2012;107140, РФ, г. Москва, Русаковская ул., д.7, стр.3;107140, РФ, г. Москва, Русаковская ул., д.7, стр.3;(495) 6458512;;;www.gorimpex.ru;;"""1027739135280""";;"""0174.02-2012-7708176124-П-070""";
"""7714722131""";ООО «ПСП-ТМГ ГРУППА» ;;;Генеральный директор;Жуковский;Олег;Григорьевич;;Действует;;;;;14.12.2012;125167, РФ, г. Москва, 4-я улица Восьмого Марта, д.6А;125167, РФ, г. Москва, 4-я улица Восьмого Марта, д.6А;(495) 6806565;;;;;"""1077763527236""";;"""0175.02-2012-7714722131-П-070""";
"""7725221627""";ООО «Стройиндустрия» ;;;Генеральный директор;Палеес;Виктор;Феликсович;;Действует;;;;;23.04.2013;105066, РФ, г. Москва, улица Ольховская, д.45, стр.1, оф.36;105066, РФ, г. Москва, улица Ольховская, д.45, стр.1, оф.36;(499) 7450396;;;;;"""1037725008320""";;"""0176.03-2013-7725221627-П-070""";
"""7714803550""";ООО «ВУРАЛ» ;;;Генеральный директор;Киселев;Артем;Сергеевич;;Действует;;;;;29.04.2014;121059, РФ, г. Москва, Бережковская набережная, д.4;121059, РФ, г. Москва, Бережковская набережная, д.4;(495) 9896106;;;;;"""1107746208404""";;"""0177.04-2014-7714803550-П-070""";
"""9909135410""";АО ХЕМОПРОЕКТ А.О, ;;;Глава представительства в;РФ;Юрак;Павел;;Действует;;;;;03.07.2012;100 31, Прага 10, ул. Тржебогостицка 14, Чешская Республика;100 31, Прага 10, ул. Тржебогостицка 14, Чешская Республика;(499) 9732425;;;www.chemoprojekt.cz;;"""452 73 383""";;"""0178.02-2012-9909135410-П-070""";
"""7737113880""";ООО «Кровстройсити» ;;;Генеральный директор;Смирнов;Сергей;Анатольевич;;Действует;;;;;10.10.2012;115682, РФ, г. Москва, ул. Шипиловская, д.64, к.1, кв.146;115682, РФ, г. Москва, ул. Шипиловская, д.64, к.1, кв.146;(495) 3961136;;;;;"""1027700084048""";;"""0179.02-2012-7737113880-П-070""";
"""7713723559""";ОАО «РТИ» ;;;Генеральный директор Боев Сергей Федотович, Председатель Правления;Боев;Сергей;Федотович;;Действует;;;;;10.08.2012;127083, РФ, г. Москва, ул. 8 Марта, д.10, стр.1;127083, РФ, г. Москва, ул. 8 Марта, д.10, стр.1;(495) 6140131;;;;;"""1117746115233""";;"""0180.02-2012-7713723559-П-070""";
"""7731599752""";ООО «Стройфаза» ;;;Генеральный директор;Капустин;Алексей;Евгеньевич;;Действует;;;;;14.12.2012;119049, РФ, г. Москва, 1-й Спасоналивковский переулок д.3/5;119049, РФ, г. Москва, 1-й Спасоналивковский переулок д.3/5;(495) 2726115;;;www.stroyfasa.ru;;"""1087746981387""";;"""0182.04-2012-7731599752-П-070""";
"""3327855793""";ООО «ТехПроектПеревооружение» ;;;Генеральный директор;Рекутина;Елена;Сергеевна;;Действует;;;;;04.03.2014;600001, РФ, Владимирская обл., г. Владимир, ул. Дворянская, д.27А;600001, РФ, Владимирская обл., г. Владимир, ул. Дворянская, д.27А;(4922) 366651;;;;;"""1113327002051""";;"""0183.03-2014-3327855793-П-070""";
"""7716687370""";ООО «М.К.3 Инжиниринг» ;;;Генеральный;директор;Мальдонадо;Робер;;Действует;;;;;25.10.2013;129344, РФ, г.Москва, ул.Искры, д.31, корпус 1, чердак помещение II, комната 7б;129344, РФ, г.Москва, ул.Искры, д.31, корпус 1, чердак помещение II, комната 7б;(495) 9378807;;;www.mk3.ru;;"""1117746299274""";;"""0184.06-2013-7716687370-П-070""";
"""7714823235""";ООО «КЕС» ;;;Генеральный директор;Беляев;Александр;Борисович;;Действует;;;;;30.10.2012;125124, РФ, г. Москва, Улица Правды, д.8, корп.13;125124, РФ, г. Москва, Улица Правды, д.8, корп.13;(495) 7805550;;;www.KESZ.ru;;"""1107746941389""";;"""0185.02-2012-7714823235-П-070""";
"""7726679280""";ООО «Модуль Инжиниринг Проект Инвест» ;;;Генеральный директор;Шаульская;Ольга;Владимировна;;Действует;;;;;29.08.2012;115191, РФ, г. Москва, Переулок Староданиловский Б., д.2, стр.9;115191, РФ, г. Москва, Переулок Староданиловский Б., д.2, стр.9;(495) 9552790;;;;;"""1117746544145""";;"""0186.02-2012-7726679280-П-070""";
"""9909014494""";АО КЮНЕН С.А. КОНТРЕКСЕВИЛЬ ;;;Глава представительства;Лагарон;Патрик;Жан-Пьер;;Действует;;;;;23.05.2014;617, рю Дивизьон Леклерк- 88140 Контрексевиль, Франция;617, рю Дивизьон Леклерк- 88140 Контрексевиль, Франция;(495) 5425169;;;www.cunin.com;;"""323 709 444""";;"""0187.02-2014-9909014494-П-070""";
"""9909324048""";КОО АКЕР САБСИ РОССИЯ АС ;;;Директор;представительства;Кнут;Сандвик;;Действует;;;;;27.09.2011;1364 ФОРНЕБЮ Снарёйвейен 36, Норвегия;1364 ФОРНЕБЮ Снарёйвейен 36, Норвегия;(495) 7752857;;;www.akersolutions.com;;"""994 570 676""";;"""0188.01-2011-9909324048-П-070""";
"""7705655312""";ООО «Архитектурная мастерская Михаила Дмитриева» ;;;Генеральный директор;Дмитриев;Михаил;Юрьевич;;Действует;;;;;10.02.2012;127006, РФ, г. Москва, Страстной бульвар, д.13А, кв.2;127006, РФ, г. Москва, Страстной бульвар, д.13А, кв.2;(985) 2209832;;;;;"""1057746600010""";;"""0190.02-2012-7705655312-П-070""";
"""7743826488""";ООО «ФАСАДЫ АА КОМПАНИ» ;;;Генеральный директор;Бакырджы;Керим;Саваш;;Действует;;;;;10.12.2013;125438, РФ, г. Москва, Лихоборская набережная, д.18А, этаж 3, комната №33;125438, РФ, г. Москва, Лихоборская набережная, д.18А, этаж 3, комната №33;(499) 6633143;;;;;"""1117746640934""";;"""0191.01-2014-7743826488-П-070""";
"""772401639440""";ИП Воронкин Анатолий Александрович ;;;;;;;;Действует;;;;;27.04.2012;;;(925) 8477564;;;;;"""311774615801472""";;"""0193.01-2012-772401639440-П-070""";
"""7704793736""";ООО «Грушвитц» ;;;Генеральный;директор;Грушвитц;Вольфганг;;Действует;;;;;04.03.2014;105082, РФ, г. Москва, Спартаковская площадь, д.14, строение 2, комната 4;105082, РФ, г. Москва, Спартаковская площадь, д.14, строение 2, комната 4;(495)5454312;;;www.gruschwitz.de;;"""1117746853905""";;"""0194.02-2014-7704793736-П-070""";
"""9909043463""";ООО ДИВИДАГ ИНТЕРНАЦИОНАЛ ГМБХ ;;;Представитель;организации;Карстен-Вильгельм;Рихтер;;Действует;;;;;18.05.2012;Миис-ван-дер-Роэ-Штрассе 6, 80807, г. Мюнхен, Федеративная Республика Германия;Миис-ван-дер-Роэ-Штрассе 6, 80807, г. Мюнхен, Федеративная Республика Германия;(495) 7370380;;;www.strabag.com;;"""HRB 128556""";;"""0195.02-2012-9909043463-П-070""";
"""9909355776""";КОО КВЭРНЕР ИНЖИНИРИНГ АС ;;;Директор филиала;Акимов;Дмитрий;Владимирович;;Действует;;;;;10.06.2014;Драмменсвейен, 264, 0283 Осло, Норвегия;Драмменсвейен, 264, 0283 Осло, Норвегия;(495) 6638391;;;www.kaverner.com;;"""996 460 274""";;"""0196.02-2014-9909355776-П-070""";
"""9909367838""";АО КОВОПРОЕКТА БРНО АКЦИОНЕРНОЕ ОБЩЕСТВО ;;;Директор;представительства;Лео;Дуспива;;Действует;;;;;18.07.2012;602 00, г. Брно, ул. Шумавска 416/15, Чешская Республика;602 00, г. Брно, ул. Шумавска 416/15, Чешская Республика;(+420) 532153273;;;www.kovoprojekta.cz;;"""463 47 011""";;"""0197.01-2012-9909367838-П-070""";
"""7709850794""";ООО «Архформат» ;;;Генеральный директор;Хмельков;Дмитрий;Юрьевич;;Действует;;;;;14.08.2012;105120, РФ, г. Москва, Нижняя Сыромятническая ул., д.10, стр.9, комната 341А;105120, РФ, г. Москва, Нижняя Сыромятническая ул., д.10, стр.9, комната 341А;(499) 678-02-68;;;www.archformat.ru;;"""1107746230350""";;"""0198.01-2012-7709850794-П-070""";
"""7722564087""";ООО «ЭмПиЭм» ;;;Генеральный;директор;Озтюрк;Кайхан;;Действует;;;;;23.05.2014;115114, РФ, г. Москва, Дербеневская набережная, дом 11, помещение В501;115114, РФ, г. Москва, Дербеневская набережная, дом 11, помещение В501;(495) 9153536;;;www.megaronfacility.com;;"""1057749400026""";;"""0199.03-2014-7722564087-П-070""";
"""9909335191""";ООО Селас-Линде ГмбХ ;;;Глава;представительства;Кедлес;Йиржи;;Действует;;;;;29.08.2012;Вольфратсхаузер Штрассе 138, 82049 Пуллах, Федеративная Республика Германия;Вольфратсхаузер Штрассе 138, 82049 Пуллах, Федеративная Республика Германия;(495) 6426242;;;www.selas-linde.de;;"""HRB 66585""";;"""0200.01-2012-9909335191-П-070""";
"""7726662504""";ООО «ФРЕЙССИНЕ» ;;;Генеральный директор Димитри;Шарль;Альбер;Плантье;;Действует;;;;;21.09.2012;117105, РФ, г. Москва, Варшавское шоссе, д.17, офис 341;117105, РФ, г. Москва, Варшавское шоссе, д.17, офис 341;(495) 6621566;;;www.freyssinet.ru;;"""1107746815802""";;"""0201.01-2012-7726662504-П-070""";
"""7718669619""";ООО «НЭК» ;;;Генеральный директор;Елисеева;Валентина;Владимировна;;Действует;;;;;10.06.2014;121471 Москва, ул. Рябиновая, д.26, стр.1, комн. №1Б;121471 Москва, ул. Рябиновая, д.26, стр.1, комн. №1Б;(495) 7408440;;;www.ruseco.com;;"""1077761223055""";;"""0202.02-2014-7718669619-П-070""";
"""7701645627""";ООО «Горный аудит» ;;;Директор;Гусев;Николай;Николаевич;;Действует;;;;;18.07.2014;105066, РФ, г. Москва, ул. Старая Басманная, д. 25, стр. 5, кв. 19;105066, РФ, г. Москва, ул. Старая Басманная, д. 25, стр. 5, кв. 19;(499) 2657961;;;www.goraudit.com;;"""1067746313898""";;"""0203.02-2014-7701645627-П-070""";
"""6315643246""";ООО «Ли Рус» ;;;Генеральный директор;Берц;Ханс;Йоахим;;Действует;;;;;17.10.2014;443001, РФ, Самарская обл. г. Самара, Ульяновская ул., д.52/55;443001, РФ, Самарская обл. г. Самара, Ульяновская ул., д.52/55;(0846) 3313332;;;www.linde.com;;"""1126315002538""";;"""0205.03-2014-6315643246-П-070""";
"""9909362808""";ООО ГОРЕНЬЕ ПРОЕКТ, д.о.о. ;;;Глава;представительства;Анте;Левай;;Действует;;;;;31.01.2013;3320, г. Веленье, Прешернова цеста, 8, Республика Словения;3320, г. Веленье, Прешернова цеста, 8, Республика Словения;(495) 9805962;;;www.gorenje-projekt.com;;"""3280047000""";;"""0206.01-2013-9909362808-П-070""";
"""9909382762""";КТ БТ-Анлагенбау ГмбХ & Ко.КГ ;;;Руководитель;филиала;Водовник;Борут;;Действует;;;;;01.02.2013;Лудерсдорф 175, 8200, г. Гляйздорф, Австрийская Республика;Лудерсдорф 175, 8200, г. Гляйздорф, Австрийская Республика;(915) 6924207;;;www.bt-anlagenbau.at;;"""FN 30287 s""";;"""0207.01-2013-9909382762-П-070""";
"""7722789115""";"ЗАО ""НИЦ ""Строймониторинг"" ";;;Директор;Середкин;Андрей;Валерьевич;;Действует;;;;;29.04.2014;127521, РФ, г. Москва, улица Анненская, д.7, корп.1;127521, РФ, г. Москва, улица Анненская, д.7, корп.1;(495)9800169;;;;;"""1127747063014""";;"""0209.02-2014-7722789115-П-070""";
"""3233005462""";"ОАО ""БЗМТО"" ";;;Генеральный директор;Анисимов;Александр;Николаевич;;Действует;;;;;19.02.2013;241903, РФ, г. Брянск, пгт. Большое Полпино, улица Инженерная, д.9;241903, РФ, г. Брянск, пгт. Большое Полпино, улица Инженерная, д.9;(4832) 732856;;;www.mstg.ru;;"""1023201098194""";;"""0210.01-2013-3233005462-П-070""";
"""9909282729""";ООО Шлеттерер ГмбХ ;;;Глава представительства;Точигин;Вячеслав;Викторович;;Действует;;;;;11.03.2013;№190 6261 Штрас в Циллертале, Австрийская Республика;№190 6261 Штрас в Циллертале, Австрийская Республика;(495) 3632082;;;www.schletterer.ru;;"""FN 172151 p""";;"""0211.01-2013-9909282729-П-070""";
"""7727271479""";"ООО УК ""НПЦ ""БАРЬЕР-3"" ";;;Генеральный директор;Литвинов;Юрий;Петрович;;Действует;;;;;20.03.2013;117452, РФ, г.Москва, улица Азовская, д.35, корп.3;117452, РФ, г.Москва, улица Азовская, д.35, корп.3;(499) 7231509;;;www.ukbarier-3.ru;;"""1057727016885""";;"""0213.01-2013-7727271479-П-070""";
"""9909263099""";КОО СВАНКИ ХЭЙДЕН КОННЕЛЛ ЛТД ;;;Глава филиала в РФ;Гурсел;Алтан;Осман;;Действует;;;;;30.09.2014;295, ул. Лафайет, Нью-Йорк, штат Нью-Йорк, 10012, США;295, ул. Лафайет, Нью-Йорк, штат Нью-Йорк, 10012, США;(495) 2585522;;;www.shca.com;;"""2198939""";;"""0215.02-2014-9909263099-П-070""";
"""9909052958""";"АО ""СЕТЕК БАТИМАН"" ";;;Директор;филиала;Кирилл;Мардухаев;;Действует;;;;;05.04.2013;75583 Париж Седекс 12, Ке де ля Рапе, 42-52, Иммебль Сантраль Сен, Франция;75583 Париж Седекс 12, Ке де ля Рапе, 42-52, Иммебль Сантраль Сен, Франция;(495) 6697664;;;;;"""2672 038 270""";;"""0216.01-2013-9909052958-П-070""";
"""7726719750""";"ООО ""КЛАНСИ ИНЖИНИРИНГ"" ";;;Генеральный директор;Кланси;Джон;Марк;;Действует;;;;;27.03.2014;127473, РФ, г. Москва, ул. Краснопролетарская, д. 16, стр.3;127473, РФ, г. Москва, ул. Краснопролетарская, д. 16, стр.3;(495) 6480942;;;www.clancy-engineering.ru;;"""1137746331876""";;"""0217.03-2014-7726719750-П-070""";
"""7713537016""";"ООО ""Новатест"" ";;;Генеральный директор;Левковский;Геннадий;Владимирович;;Действует;;;;;21.06.2013;141401, РФ, Московская область, г.Химки, Ленинский пр-т, д.1, корп.2;141401, РФ, Московская область, г.Химки, Ленинский пр-т, д.1, корп.2;(495) 7885523;;;www.novatest.ru;;"""1047796729111""";;"""0218.01-2013-7713537016-П-070""";
"""9909342833""";"КК ""ЭНГлобал Ю.Эс., Инк."" ";;;Директор филиала;Богородицкая;Екатерина;Анатольевна;;Действует;;;;;25.10.2013;800 Бразос, офис 400, Остин, Техас 78701, США;800 Бразос, офис 400, Остин, Техас 78701, США;(499) 2548298;;;www.englobal.com;;"""131675700""";;"""0219.02-2013-9909342833-П-070""";
